[{
	"index": 0,
	"title": "Computer Related",
	"id": 622043,
	"parentId": "1",
	"dateAddedLocal": "10/25/2022, 12:34:39 PM",
	"dateAddedUTC": "2022-10-25T16:34:39.300Z"
},{
	"index": 0,
	"title": "File Organization",
	"id": 622044,
	"parentId": "622043",
	"dateAddedLocal": "10/25/2022, 12:34:39 PM",
	"dateAddedUTC": "2022-10-25T16:34:39.300Z"
},{
	"index": 0,
	"title": "Organizing photo collection – 20 years research",
	"url": "https://mnaoumov.wordpress.com/2021/04/18/organizing-photo-collection-20-years-research/",
	"id": 622045,
	"parentId": "622044",
	"dateAddedLocal": "8/2/2022, 4:41:27 PM",
	"dateAddedUTC": "2022-08-02T20:41:27.000Z"
},{
	"index": 1,
	"title": "Hard Drives",
	"id": 622046,
	"parentId": "622043",
	"dateAddedLocal": "10/25/2022, 12:34:39 PM",
	"dateAddedUTC": "2022-10-25T16:34:39.300Z"
},{
	"index": 0,
	"title": "Data Recovery Ann Arbor Hard Drive & RAID Recovery Service",
	"url": "https://www.filesaversdatarecovery.com/locations/michigan/data-recovery-in-ann-arbor-mi.html",
	"id": 622047,
	"parentId": "622046",
	"dateAddedLocal": "2/24/2022, 8:17:34 AM",
	"dateAddedUTC": "2022-02-24T13:17:34.000Z"
},{
	"index": 1,
	"title": "Fix Seagate ST31000528AS PCB Board 100536501",
	"url": "https://www.hddzone.com/blog/fix-seagate-st31000528as-pcb-board-100536501",
	"id": 622048,
	"parentId": "622046",
	"dateAddedLocal": "2/24/2022, 8:17:34 AM",
	"dateAddedUTC": "2022-02-24T13:17:34.000Z"
},{
	"index": 2,
	"title": "replacing a seagate st31000528as hard drive | Tom's Hardware Forum",
	"url": "https://forums.tomshardware.com/threads/replacing-a-seagate-st31000528as-hard-drive.2632193",
	"id": 622049,
	"parentId": "622046",
	"dateAddedLocal": "2/24/2022, 8:17:34 AM",
	"dateAddedUTC": "2022-02-24T13:17:34.000Z"
},{
	"index": 3,
	"title": "Seagate ST31000528AS 9SL154-578 CC38 WU 100536501 Donor PCB Barracuda 7200.12 1TB + Firmware Transfer",
	"url": "https://www.onepcbsolution.com/729280851st.html",
	"id": 622050,
	"parentId": "622046",
	"dateAddedLocal": "2/24/2022, 8:17:34 AM",
	"dateAddedUTC": "2022-02-24T13:17:34.000Z"
},{
	"index": 4,
	"title": "Seagate ST31000528AS Hard Drive SATA-II 1TB-7.2K RPM | Refurbished",
	"url": "https://www.allhdd.com/hard-disk-drive/sata-ii/1tb-7.2k-rpm/seagate-st31000528as-rfb?gclid=CjwKCAjw3pWDBhB3EiwAV1c5rGmm1gjrjSvkZ5aqWXFZ6J6_U5e_bRI4RZ7TTT5K4NmdUmaB1WZRYRoC0VIQAvD_BwE",
	"id": 622051,
	"parentId": "622046",
	"dateAddedLocal": "2/24/2022, 8:17:34 AM",
	"dateAddedUTC": "2022-02-24T13:17:34.000Z"
},{
	"index": 5,
	"title": "Seagate ST31000528AS PCB Board | HDDZone Blog",
	"url": "https://www.hddzone.com/blog/seagate-st31000528as-pcb-board",
	"id": 622052,
	"parentId": "622046",
	"dateAddedLocal": "2/24/2022, 8:17:34 AM",
	"dateAddedUTC": "2022-02-24T13:17:34.000Z"
},{
	"index": 6,
	"title": "Seagate ST31000528AS Repair & Data Recovery | Outsource Data Recovery",
	"url": "https://outsourcedatarecovery.com/st31000528as-repair",
	"id": 622053,
	"parentId": "622046",
	"dateAddedLocal": "2/24/2022, 8:17:34 AM",
	"dateAddedUTC": "2022-02-24T13:17:34.000Z"
},{
	"index": 7,
	"title": "ST31000528AS - Seagate Barracuda 7200.12 1TB 7200RPM SATA 3Gb/s 32MB Cache 3.5-inch Hard Drive",
	"url": "https://harddiskdirect.com/st31000528as-seagate-desktop-hard-drive.html",
	"id": 622054,
	"parentId": "622046",
	"dateAddedLocal": "2/24/2022, 8:17:34 AM",
	"dateAddedUTC": "2022-02-24T13:17:34.000Z"
},{
	"index": 8,
	"title": "ST31000528AS 9SL154-021 HP34 SU 100536501 REV A 3.5'' SATA 1TB Seagate Barracuda 7200.12 circuit board +FW Seagate repair fix swap PCB circuit board parts donor board replacement burnt controller board green card mother card hard drive data recovery",
	"url": "https://www.hdd-parts.com/14012110.html",
	"id": 622055,
	"parentId": "622046",
	"dateAddedLocal": "2/24/2022, 8:17:34 AM",
	"dateAddedUTC": "2022-02-24T13:17:34.000Z"
},{
	"index": 9,
	"title": "ST31000528AS, 9VP, SU, PN 9SL154-302, FW CC38, Seagate 1TB SATA 3.5 Hard Drive",
	"url": "https://www.donordrives.com/st31000528as-9vp-su-pn-9sl154-302-fw-cc38-seagate-1tb-sata-3-5-hard-drive.html",
	"id": 622056,
	"parentId": "622046",
	"dateAddedLocal": "2/24/2022, 8:17:34 AM",
	"dateAddedUTC": "2022-02-24T13:17:34.000Z"
},{
	"index": 2,
	"title": "Linux",
	"id": 622057,
	"parentId": "622043",
	"dateAddedLocal": "10/25/2022, 12:34:39 PM",
	"dateAddedUTC": "2022-10-25T16:34:39.301Z"
},{
	"index": 0,
	"title": "Home | Redcore Linux Project",
	"url": "https://redcorelinux.org/",
	"id": 622058,
	"parentId": "622057",
	"dateAddedLocal": "3/17/2022, 8:55:00 PM",
	"dateAddedUTC": "2022-03-18T00:55:00.000Z"
},{
	"index": 1,
	"title": "index | Alpine Linux",
	"url": "https://alpinelinux.org/",
	"id": 622059,
	"parentId": "622057",
	"dateAddedLocal": "3/17/2022, 8:34:50 PM",
	"dateAddedUTC": "2022-03-18T00:34:50.000Z"
},{
	"index": 2,
	"title": "Nitrux — #YourNextOS — A Linux for Everyone",
	"url": "https://nxos.org/",
	"id": 622060,
	"parentId": "622057",
	"dateAddedLocal": "3/17/2022, 6:47:55 PM",
	"dateAddedUTC": "2022-03-17T22:47:55.000Z"
},{
	"index": 3,
	"title": "Archcraft : Home",
	"url": "https://archcraft-os.github.io/",
	"id": 622061,
	"parentId": "622057",
	"dateAddedLocal": "3/15/2022, 2:28:47 PM",
	"dateAddedUTC": "2022-03-15T18:28:47.000Z"
},{
	"index": 4,
	"title": "Obscurix",
	"url": "https://obscurix.github.io/",
	"id": 622062,
	"parentId": "622057",
	"dateAddedLocal": "3/15/2022, 2:28:47 PM",
	"dateAddedUTC": "2022-03-15T18:28:47.000Z"
},{
	"index": 5,
	"title": "Howtoforge Linux Tutorials.",
	"url": "https://www.howtoforge.com/",
	"id": 622063,
	"parentId": "622057",
	"dateAddedLocal": "3/12/2022, 4:08:45 PM",
	"dateAddedUTC": "2022-03-12T21:08:45.000Z"
},{
	"index": 6,
	"title": "JingOS | Future Mobile OS based on Linux - JingLing",
	"url": "https://en.jingos.com/",
	"id": 622064,
	"parentId": "622057",
	"dateAddedLocal": "1/17/2022, 11:38:25 PM",
	"dateAddedUTC": "2022-01-18T04:38:25.000Z"
},{
	"index": 7,
	"title": "Home - Peux OS",
	"url": "https://peux-os.netlify.app/",
	"id": 622065,
	"parentId": "622057",
	"dateAddedLocal": "1/17/2022, 11:38:26 PM",
	"dateAddedUTC": "2022-01-18T04:38:26.000Z"
},{
	"index": 8,
	"title": "Homepage - predator-os",
	"url": "https://predator-os.com/",
	"id": 622066,
	"parentId": "622057",
	"dateAddedLocal": "1/12/2022, 4:18:03 PM",
	"dateAddedUTC": "2022-01-12T21:18:03.000Z"
},{
	"index": 9,
	"title": "Linux",
	"id": 622067,
	"parentId": "622057",
	"dateAddedLocal": "10/25/2022, 12:34:39 PM",
	"dateAddedUTC": "2022-10-25T16:34:39.301Z"
},{
	"index": 0,
	"title": "Home | Serpent OS",
	"url": "https://www.serpentos.com/",
	"id": 622068,
	"parentId": "622067",
	"dateAddedLocal": "3/25/2022, 12:21:05 AM",
	"dateAddedUTC": "2022-03-25T04:21:05.000Z"
},{
	"index": 1,
	"title": "Ubuntu MATE | For a retrospective future",
	"url": "https://ubuntu-mate.org/",
	"id": 622069,
	"parentId": "622067",
	"dateAddedLocal": "3/25/2022, 12:17:58 AM",
	"dateAddedUTC": "2022-03-25T04:17:58.000Z"
},{
	"index": 2,
	"title": "SELinux Project",
	"url": "https://github.com/SELinuxProject",
	"id": 622070,
	"parentId": "622067",
	"dateAddedLocal": "3/24/2022, 6:58:39 AM",
	"dateAddedUTC": "2022-03-24T10:58:39.000Z"
},{
	"index": 3,
	"title": "Garuda Linux Official website",
	"url": "https://www.garudalinux.org/",
	"id": 622071,
	"parentId": "622067",
	"dateAddedLocal": "3/24/2022, 6:56:55 AM",
	"dateAddedUTC": "2022-03-24T10:56:55.000Z"
},{
	"index": 4,
	"title": "A curated list of linux laptop and desktop vendors",
	"url": "https://linuxpreloaded.com/",
	"id": 622072,
	"parentId": "622067",
	"dateAddedLocal": "3/24/2022, 6:54:39 AM",
	"dateAddedUTC": "2022-03-24T10:54:39.000Z"
},{
	"index": 5,
	"title": "MX Linux – Midweight Simple Stable Desktop OS",
	"url": "https://mxlinux.org/",
	"id": 622073,
	"parentId": "622067",
	"dateAddedLocal": "3/24/2022, 6:51:34 AM",
	"dateAddedUTC": "2022-03-24T10:51:34.000Z"
},{
	"index": 6,
	"title": "Welcome to devuan.org | Devuan GNU+Linux Free Operating System",
	"url": "https://www.devuan.org/",
	"id": 622074,
	"parentId": "622067",
	"dateAddedLocal": "3/23/2022, 7:02:50 AM",
	"dateAddedUTC": "2022-03-23T11:02:50.000Z"
},{
	"index": 7,
	"title": "ArcoLinux | ArcoLinux",
	"url": "https://www.arcolinux.info/",
	"id": 622075,
	"parentId": "622067",
	"dateAddedLocal": "3/18/2022, 5:11:50 PM",
	"dateAddedUTC": "2022-03-18T21:11:50.000Z"
},{
	"index": 8,
	"title": "Anarchy",
	"url": "https://artixlinux.org/",
	"id": 622076,
	"parentId": "622067",
	"dateAddedLocal": "2/24/2022, 8:17:34 AM",
	"dateAddedUTC": "2022-02-24T13:17:34.000Z"
},{
	"index": 9,
	"title": "Archcraft",
	"url": "https://fivemm.shop/",
	"id": 622077,
	"parentId": "622067",
	"dateAddedLocal": "2/24/2022, 8:17:34 AM",
	"dateAddedUTC": "2022-02-24T13:17:34.000Z"
},{
	"index": 10,
	"title": "Archcraft",
	"url": "https://freedownloadae.com/",
	"id": 622078,
	"parentId": "622067",
	"dateAddedLocal": "2/24/2022, 8:17:34 AM",
	"dateAddedUTC": "2022-02-24T13:17:34.000Z"
},{
	"index": 11,
	"title": "Artix",
	"url": "https://larder.io/",
	"id": 622079,
	"parentId": "622067",
	"dateAddedLocal": "2/24/2022, 8:17:34 AM",
	"dateAddedUTC": "2022-02-24T13:17:34.000Z"
},{
	"index": 12,
	"title": "Bedrock Linux",
	"url": "https://bedrocklinux.org/",
	"id": 622080,
	"parentId": "622067",
	"dateAddedLocal": "2/24/2022, 8:17:34 AM",
	"dateAddedUTC": "2022-02-24T13:17:34.000Z"
},{
	"index": 13,
	"title": "Best Linux and Cloud Training Certification Pricing | Linux Academy",
	"url": "https://acloudguru.com/pricing",
	"id": 622081,
	"parentId": "622067",
	"dateAddedLocal": "2/24/2022, 8:17:34 AM",
	"dateAddedUTC": "2022-02-24T13:17:34.000Z"
},{
	"index": 14,
	"title": "Best Linux and Cloud Training Certification Pricing | Linux Academy",
	"url": "https://linuxacademy.com/join/pricing?redirect=%2Fcp%2Fmodules%2Fview%2Fid%2F38",
	"id": 622082,
	"parentId": "622067",
	"dateAddedLocal": "2/24/2022, 8:17:34 AM",
	"dateAddedUTC": "2022-02-24T13:17:34.000Z"
},{
	"index": 15,
	"title": "EndeavourOS – A terminal-centric distro with a dynamic and friendly community in its core",
	"url": "https://endeavouros.com/",
	"id": 622083,
	"parentId": "622067",
	"dateAddedLocal": "2/24/2022, 8:17:34 AM",
	"dateAddedUTC": "2022-02-24T13:17:34.000Z"
},{
	"index": 16,
	"title": "Gallium",
	"url": "https://virtualcustoms.net/",
	"id": 622084,
	"parentId": "622067",
	"dateAddedLocal": "2/24/2022, 8:17:34 AM",
	"dateAddedUTC": "2022-02-24T13:17:34.000Z"
},{
	"index": 17,
	"title": "Gobo Linux",
	"url": "https://www.gobolinux.org/",
	"id": 622085,
	"parentId": "622067",
	"dateAddedLocal": "2/24/2022, 8:17:34 AM",
	"dateAddedUTC": "2022-02-24T13:17:34.000Z"
},{
	"index": 18,
	"title": "Gurlic",
	"url": "https://www.redox-os.org/",
	"id": 622086,
	"parentId": "622067",
	"dateAddedLocal": "2/24/2022, 8:17:34 AM",
	"dateAddedUTC": "2022-02-24T13:17:34.000Z"
},{
	"index": 19,
	"title": "Mutaz",
	"url": "https://anarchyinstaller.org/",
	"id": 622087,
	"parentId": "622067",
	"dateAddedLocal": "2/24/2022, 8:17:34 AM",
	"dateAddedUTC": "2022-02-24T13:17:34.000Z"
},{
	"index": 20,
	"title": "Onworks",
	"url": "https://www.onworks.net/?=0&service=lang-en-en",
	"id": 622088,
	"parentId": "622067",
	"dateAddedLocal": "2/24/2022, 8:17:34 AM",
	"dateAddedUTC": "2022-02-24T13:17:34.000Z"
},{
	"index": 21,
	"title": "Oracle",
	"url": "https://www.oracle.com/linux",
	"id": 622089,
	"parentId": "622067",
	"dateAddedLocal": "2/24/2022, 8:17:34 AM",
	"dateAddedUTC": "2022-02-24T13:17:34.000Z"
},{
	"index": 22,
	"title": "Oracle Linux",
	"url": "https://rockylinux.org/",
	"id": 622090,
	"parentId": "622067",
	"dateAddedLocal": "2/24/2022, 8:17:34 AM",
	"dateAddedUTC": "2022-02-24T13:17:34.000Z"
},{
	"index": 23,
	"title": "ReduxOS",
	"url": "https://improvmx.com/",
	"id": 622091,
	"parentId": "622067",
	"dateAddedLocal": "2/24/2022, 8:17:34 AM",
	"dateAddedUTC": "2022-02-24T13:17:34.000Z"
},{
	"index": 24,
	"title": "Rocky Linux",
	"url": "https://bitcoinbookmarks.com/",
	"id": 622092,
	"parentId": "622067",
	"dateAddedLocal": "2/24/2022, 8:17:34 AM",
	"dateAddedUTC": "2022-02-24T13:17:34.000Z"
},{
	"index": 25,
	"title": "SerenityOS",
	"url": "https://serenityos.org/",
	"id": 622093,
	"parentId": "622067",
	"dateAddedLocal": "2/24/2022, 8:17:34 AM",
	"dateAddedUTC": "2022-02-24T13:17:34.000Z"
},{
	"index": 26,
	"title": "TempleOS: 1 - Installation - Christine Dodrill",
	"url": "https://christine.website/blog/templeos-1-installation-and-basic-use-2019-05-20",
	"id": 622094,
	"parentId": "622067",
	"dateAddedLocal": "2/24/2022, 8:17:34 AM",
	"dateAddedUTC": "2022-02-24T13:17:34.000Z"
},{
	"index": 27,
	"title": "The Debian Administrator's Handbook",
	"url": "https://www.debian.org/doc/manuals/debian-handbook",
	"id": 622095,
	"parentId": "622067",
	"dateAddedLocal": "2/24/2022, 8:17:34 AM",
	"dateAddedUTC": "2022-02-24T13:17:34.000Z"
},{
	"index": 28,
	"title": "UNIX and Linux Essentials| Solaris 11 Administration | Oracle Solaris | Operating Systems | Training| Oracle",
	"url": "https://education.oracle.com/oracle-it-infrastructure-learning-subscription/ls_50041",
	"id": 622096,
	"parentId": "622067",
	"dateAddedLocal": "2/24/2022, 8:17:34 AM",
	"dateAddedUTC": "2022-02-24T13:17:34.000Z"
},{
	"index": 29,
	"title": "UNIX and Linux Essentials| Solaris 11 Administration | Oracle Solaris | Operating Systems | Training| Oracle",
	"url": "https://education.oracle.com/pls/web_prod-plq-dad/db_pages.getpage?get_params=dc%3AD76989%2Cclang%3AEN&page_id=609",
	"id": 622097,
	"parentId": "622067",
	"dateAddedLocal": "2/24/2022, 8:17:34 AM",
	"dateAddedUTC": "2022-02-24T13:17:34.000Z"
},{
	"index": 30,
	"title": "Linux Tools",
	"id": 622098,
	"parentId": "622067",
	"dateAddedLocal": "10/25/2022, 12:34:39 PM",
	"dateAddedUTC": "2022-10-25T16:34:39.302Z"
},{
	"index": 0,
	"title": "Archcraft.io",
	"url": "https://archcraft.io/",
	"id": 622099,
	"parentId": "622098",
	"dateAddedLocal": "3/18/2022, 5:11:50 PM",
	"dateAddedUTC": "2022-03-18T21:11:50.000Z"
},{
	"index": 1,
	"title": "Distros",
	"id": 622100,
	"parentId": "622098",
	"dateAddedLocal": "10/25/2022, 12:34:39 PM",
	"dateAddedUTC": "2022-10-25T16:34:39.302Z"
},{
	"index": 0,
	"title": "Antixlinux",
	"url": "https://antixlinux.com/",
	"id": 622101,
	"parentId": "622100",
	"dateAddedLocal": "3/18/2022, 5:11:50 PM",
	"dateAddedUTC": "2022-03-18T21:11:50.000Z"
},{
	"index": 1,
	"title": "CAINE",
	"url": "https://www.caine-live.net/page5/page5.html",
	"id": 622102,
	"parentId": "622100",
	"dateAddedLocal": "2/24/2022, 8:17:34 AM",
	"dateAddedUTC": "2022-02-24T13:17:34.000Z"
},{
	"index": 2,
	"title": "CSI Linux",
	"url": "https://csilinux.com/download.html",
	"id": 622103,
	"parentId": "622100",
	"dateAddedLocal": "2/24/2022, 8:17:34 AM",
	"dateAddedUTC": "2022-02-24T13:17:34.000Z"
},{
	"index": 3,
	"title": "FLARE VM - FireEye",
	"url": "https://github.com/fireeye/flare-vm",
	"id": 622104,
	"parentId": "622100",
	"dateAddedLocal": "2/24/2022, 8:17:34 AM",
	"dateAddedUTC": "2022-02-24T13:17:34.000Z"
},{
	"index": 4,
	"title": "PALADIN",
	"url": "https://sumuri.com/software/paladin",
	"id": 622105,
	"parentId": "622100",
	"dateAddedLocal": "2/24/2022, 8:17:34 AM",
	"dateAddedUTC": "2022-02-24T13:17:34.000Z"
},{
	"index": 5,
	"title": "REMnux",
	"url": "https://remnux.org/",
	"id": 622106,
	"parentId": "622100",
	"dateAddedLocal": "2/24/2022, 8:17:34 AM",
	"dateAddedUTC": "2022-02-24T13:17:34.000Z"
},{
	"index": 6,
	"title": "SANS SIFT Workstation",
	"url": "https://www.sans.org/tools/sift-workstation",
	"id": 622107,
	"parentId": "622100",
	"dateAddedLocal": "2/24/2022, 8:17:34 AM",
	"dateAddedUTC": "2022-02-24T13:17:34.000Z"
},{
	"index": 7,
	"title": "SOF-ELK",
	"url": "https://github.com/philhagen/sof-elk",
	"id": 622108,
	"parentId": "622100",
	"dateAddedLocal": "2/24/2022, 8:17:34 AM",
	"dateAddedUTC": "2022-02-24T13:17:34.000Z"
},{
	"index": 8,
	"title": "Tsurugi",
	"url": "https://tsurugi-linux.org/downloads.php",
	"id": 622109,
	"parentId": "622100",
	"dateAddedLocal": "2/24/2022, 8:17:34 AM",
	"dateAddedUTC": "2022-02-24T13:17:34.000Z"
},{
	"index": 9,
	"title": "Discreet",
	"url": "https://www.discreete-linux.org/",
	"id": 622110,
	"parentId": "622100",
	"dateAddedLocal": "2/24/2022, 8:17:34 AM",
	"dateAddedUTC": "2022-02-24T13:17:34.000Z"
},{
	"index": 10,
	"title": "Fedora",
	"url": "https://fedoraproject.org/wiki/SELinux",
	"id": 622111,
	"parentId": "622100",
	"dateAddedLocal": "2/24/2022, 8:17:34 AM",
	"dateAddedUTC": "2022-02-24T13:17:34.000Z"
},{
	"index": 11,
	"title": "Kodachi",
	"url": "https://www.digi77.com/linux-kodachi",
	"id": 622112,
	"parentId": "622100",
	"dateAddedLocal": "2/24/2022, 8:17:34 AM",
	"dateAddedUTC": "2022-02-24T13:17:34.000Z"
},{
	"index": 12,
	"title": "Linux Respin | Respin your distro",
	"url": "https://www.linuxrespin.org/",
	"id": 622113,
	"parentId": "622100",
	"dateAddedLocal": "2/24/2022, 8:17:34 AM",
	"dateAddedUTC": "2022-02-24T13:17:34.000Z"
},{
	"index": 13,
	"title": "Linux Tutorial",
	"url": "https://linuxsurvival.com/linux-tutorial-introduction",
	"id": 622114,
	"parentId": "622100",
	"dateAddedLocal": "2/24/2022, 8:17:34 AM",
	"dateAddedUTC": "2022-02-24T13:17:34.000Z"
},{
	"index": 14,
	"title": "Pure OS + Hardware",
	"url": "https://puri.sm/products/librem-13",
	"id": 622115,
	"parentId": "622100",
	"dateAddedLocal": "2/24/2022, 8:17:34 AM",
	"dateAddedUTC": "2022-02-24T13:17:34.000Z"
},{
	"index": 15,
	"title": "Qubes OS",
	"url": "https://www.qubes-os.org/",
	"id": 622116,
	"parentId": "622100",
	"dateAddedLocal": "2/24/2022, 8:17:34 AM",
	"dateAddedUTC": "2022-02-24T13:17:34.000Z"
},{
	"index": 16,
	"title": "SIFT Workstation Download (SANS DFIR)",
	"url": "https://digital-forensics.sans.org/community/downloads",
	"id": 622117,
	"parentId": "622100",
	"dateAddedLocal": "2/24/2022, 8:17:34 AM",
	"dateAddedUTC": "2022-02-24T13:17:34.000Z"
},{
	"index": 17,
	"title": "Subgraph",
	"url": "https://subgraph.com/",
	"id": 622118,
	"parentId": "622100",
	"dateAddedLocal": "2/24/2022, 8:17:34 AM",
	"dateAddedUTC": "2022-02-24T13:17:34.000Z"
},{
	"index": 18,
	"title": "TENS",
	"url": "https://www.gettens.online/",
	"id": 622119,
	"parentId": "622100",
	"dateAddedLocal": "2/24/2022, 8:17:34 AM",
	"dateAddedUTC": "2022-02-24T13:17:34.000Z"
},{
	"index": 19,
	"title": "Tails",
	"url": "https://tails.boum.org/",
	"id": 622120,
	"parentId": "622100",
	"dateAddedLocal": "2/24/2022, 8:17:34 AM",
	"dateAddedUTC": "2022-02-24T13:17:34.000Z"
},{
	"index": 20,
	"title": "Tails",
	"url": "https://tails.boum.org/index.de.html",
	"id": 622121,
	"parentId": "622100",
	"dateAddedLocal": "2/24/2022, 8:17:34 AM",
	"dateAddedUTC": "2022-02-24T13:17:34.000Z"
},{
	"index": 21,
	"title": "Tinhat",
	"url": "https://sourceforge.net/projects/tinhat",
	"id": 622122,
	"parentId": "622100",
	"dateAddedLocal": "2/24/2022, 8:17:34 AM",
	"dateAddedUTC": "2022-02-24T13:17:34.000Z"
},{
	"index": 22,
	"title": "Tsurugi-linux",
	"url": "https://tsurugi-linux.org/index.php",
	"id": 622123,
	"parentId": "622100",
	"dateAddedLocal": "2/24/2022, 8:17:34 AM",
	"dateAddedUTC": "2022-02-24T13:17:34.000Z"
},{
	"index": 23,
	"title": "Ubuntu",
	"url": "https://www.ubuntu.com/",
	"id": 622124,
	"parentId": "622100",
	"dateAddedLocal": "2/24/2022, 8:17:34 AM",
	"dateAddedUTC": "2022-02-24T13:17:34.000Z"
},{
	"index": 24,
	"title": "Whonix",
	"url": "https://www.whonix.org/",
	"id": 622125,
	"parentId": "622100",
	"dateAddedLocal": "2/24/2022, 8:17:34 AM",
	"dateAddedUTC": "2022-02-24T13:17:34.000Z"
},{
	"index": 25,
	"title": "OSINT VM",
	"url": "https://www.tracelabs.org/initiatives/osint-vm",
	"id": 622126,
	"parentId": "622100",
	"dateAddedLocal": "2/24/2022, 8:17:34 AM",
	"dateAddedUTC": "2022-02-24T13:17:34.000Z"
},{
	"index": 26,
	"title": "Osintux.org",
	"url": "https://www.osintux.org/",
	"id": 622127,
	"parentId": "622100",
	"dateAddedLocal": "2/24/2022, 8:17:34 AM",
	"dateAddedUTC": "2022-02-24T13:17:34.000Z"
},{
	"index": 27,
	"title": "Tails - Download and install Tails",
	"url": "https://tails.boum.org/install",
	"id": 622128,
	"parentId": "622100",
	"dateAddedLocal": "2/24/2022, 8:17:34 AM",
	"dateAddedUTC": "2022-02-24T13:17:34.000Z"
},{
	"index": 28,
	"title": "axlshear/dora-osint-vm",
	"url": "https://github.com/axlshear/dora-osint-vm",
	"id": 622129,
	"parentId": "622100",
	"dateAddedLocal": "2/24/2022, 8:17:34 AM",
	"dateAddedUTC": "2022-02-24T13:17:34.000Z"
},{
	"index": 2,
	"title": "Domain, IP & Web Searches",
	"id": 622130,
	"parentId": "622098",
	"dateAddedLocal": "10/25/2022, 12:34:39 PM",
	"dateAddedUTC": "2022-10-25T16:34:39.303Z"
},{
	"index": 0,
	"title": "GitHub - Yashvendra/Recon-X: Advanced Reconnaissance tool to enumerate attacking surface of the target.",
	"url": "https://github.com/Yashvendra/Recon-X.git",
	"id": 622131,
	"parentId": "622130",
	"dateAddedLocal": "2/24/2022, 8:17:34 AM",
	"dateAddedUTC": "2022-02-24T13:17:34.000Z"
},{
	"index": 1,
	"title": "GitHub - s0md3v/Photon: Incredibly fast crawler designed for OSINT.",
	"url": "https://github.com/s0md3v/Photon",
	"id": 622132,
	"parentId": "622130",
	"dateAddedLocal": "2/24/2022, 8:17:34 AM",
	"dateAddedUTC": "2022-02-24T13:17:34.000Z"
},{
	"index": 2,
	"title": "abdulgaphy/r3con1z3r",
	"url": "https://github.com/abdulgaphy/r3con1z3r",
	"id": 622133,
	"parentId": "622130",
	"dateAddedLocal": "2/24/2022, 8:17:34 AM",
	"dateAddedUTC": "2022-02-24T13:17:34.000Z"
},{
	"index": 3,
	"title": "harleo/knockknock",
	"url": "https://github.com/harleo/knockknock",
	"id": 622134,
	"parentId": "622130",
	"dateAddedLocal": "2/24/2022, 8:17:34 AM",
	"dateAddedUTC": "2022-02-24T13:17:34.000Z"
},{
	"index": 4,
	"title": "thewhiteh4t/FinalRecon",
	"url": "https://github.com/thewhiteh4t/FinalRecon",
	"id": 622135,
	"parentId": "622130",
	"dateAddedLocal": "2/24/2022, 8:17:34 AM",
	"dateAddedUTC": "2022-02-24T13:17:34.000Z"
},{
	"index": 3,
	"title": "Email Recon",
	"id": 622136,
	"parentId": "622098",
	"dateAddedLocal": "10/25/2022, 12:34:39 PM",
	"dateAddedUTC": "2022-10-25T16:34:39.303Z"
},{
	"index": 0,
	"title": "GitHub - WhiteHatInspector/emailGuesser: This is an open source project which helps users \"guess\" their target's email address based on multiple inputs and preferences.",
	"url": "https://github.com/WhiteHatInspector/emailGuesser",
	"id": 622137,
	"parentId": "622136",
	"dateAddedLocal": "2/24/2022, 8:17:34 AM",
	"dateAddedUTC": "2022-02-24T13:17:34.000Z"
},{
	"index": 1,
	"title": "GitHub - laramies/theHarvester: E-mails, subdomains and names Harvester - OSINT",
	"url": "https://github.com/laramies/theHarvester.git",
	"id": 622138,
	"parentId": "622136",
	"dateAddedLocal": "2/24/2022, 8:17:34 AM",
	"dateAddedUTC": "2022-02-24T13:17:34.000Z"
},{
	"index": 2,
	"title": "GitHub - woj-ciech/Danger-zone: Correlate data between domains, IPs and email addresses, present it as a graph and store everything into Elasticsearch and JSON files.",
	"url": "https://github.com/woj-ciech/Danger-zone",
	"id": 622139,
	"parentId": "622136",
	"dateAddedLocal": "2/24/2022, 8:17:34 AM",
	"dateAddedUTC": "2022-02-24T13:17:34.000Z"
},{
	"index": 3,
	"title": "sham00n/buster",
	"url": "https://github.com/sham00n/buster",
	"id": 622140,
	"parentId": "622136",
	"dateAddedLocal": "2/24/2022, 8:17:34 AM",
	"dateAddedUTC": "2022-02-24T13:17:34.000Z"
},{
	"index": 4,
	"title": "Facebook",
	"id": 622141,
	"parentId": "622098",
	"dateAddedLocal": "10/25/2022, 12:34:39 PM",
	"dateAddedUTC": "2022-10-25T16:34:39.303Z"
},{
	"index": 0,
	"title": "harismuneer/Ultimate-Facebook-Scraper",
	"url": "https://github.com/harismuneer/Ultimate-Facebook-Scraper",
	"id": 622142,
	"parentId": "622141",
	"dateAddedLocal": "2/24/2022, 8:17:34 AM",
	"dateAddedUTC": "2022-02-24T13:17:34.000Z"
},{
	"index": 5,
	"title": "Instagram",
	"id": 622143,
	"parentId": "622098",
	"dateAddedLocal": "10/25/2022, 12:34:39 PM",
	"dateAddedUTC": "2022-10-25T16:34:39.304Z"
},{
	"index": 0,
	"title": "GitHub - bernsteining/InstaLocTrack: A SOCMINT/OSINT project which goal is to fetch all the locations related to an Instagram profile in order to plot them on a map.",
	"url": "https://github.com/bernsteining/InstaLocTrack",
	"id": 622144,
	"parentId": "622143",
	"dateAddedLocal": "2/24/2022, 8:17:34 AM",
	"dateAddedUTC": "2022-02-24T13:17:34.000Z"
},{
	"index": 1,
	"title": "GitHub - blackhatethicalhacking/InstagramOSINT: An Instagram Open Source Intelligence Tool",
	"url": "https://github.com/blackhatethicalhacking/InstagramOSINT",
	"id": 622145,
	"parentId": "622143",
	"dateAddedLocal": "2/24/2022, 8:17:34 AM",
	"dateAddedUTC": "2022-02-24T13:17:34.000Z"
},{
	"index": 2,
	"title": "rarcega/instagram-scraper",
	"url": "https://github.com/rarcega/instagram-scraper",
	"id": 622146,
	"parentId": "622143",
	"dateAddedLocal": "2/24/2022, 8:17:34 AM",
	"dateAddedUTC": "2022-02-24T13:17:34.000Z"
},{
	"index": 6,
	"title": "LinkedIn",
	"id": 622147,
	"parentId": "622098",
	"dateAddedLocal": "10/25/2022, 12:34:39 PM",
	"dateAddedUTC": "2022-10-25T16:34:39.304Z"
},{
	"index": 0,
	"title": "GitHub - 0xZDH/BridgeKeeper: Scrape employee names from search engine LinkedIn profiles. Convert employee names to a specified username format.",
	"url": "https://github.com/0xZDH/BridgeKeeper",
	"id": 622148,
	"parentId": "622147",
	"dateAddedLocal": "2/24/2022, 8:17:34 AM",
	"dateAddedUTC": "2022-02-24T13:17:34.000Z"
},{
	"index": 1,
	"title": "GitHub - m8r0wn/CrossLinked: LinkedIn enumeration tool to extract valid employee names from an organization through search engine scraping. Names can be formatted in a defined naming convention for further security testing.",
	"url": "https://github.com/m8r0wn/CrossLinked",
	"id": 622149,
	"parentId": "622147",
	"dateAddedLocal": "2/24/2022, 8:17:34 AM",
	"dateAddedUTC": "2022-02-24T13:17:34.000Z"
},{
	"index": 7,
	"title": "Pastebin Scraping",
	"id": 622150,
	"parentId": "622098",
	"dateAddedLocal": "10/25/2022, 12:34:39 PM",
	"dateAddedUTC": "2022-10-25T16:34:39.304Z"
},{
	"index": 0,
	"title": "GitHub - sandwichi/pastebin-scraper: Scrapes pastebin.com API for pastes containing supplied keywords.",
	"url": "https://github.com/sandwichi/pastebin-scraper",
	"id": 622151,
	"parentId": "622150",
	"dateAddedLocal": "2/24/2022, 8:17:34 AM",
	"dateAddedUTC": "2022-02-24T13:17:34.000Z"
},{
	"index": 8,
	"title": "People Recon",
	"id": 622152,
	"parentId": "622098",
	"dateAddedLocal": "10/25/2022, 12:34:39 PM",
	"dateAddedUTC": "2022-10-25T16:34:39.304Z"
},{
	"index": 0,
	"title": "GitHub - 1d8/username.py: US name osint searches",
	"url": "https://github.com/1d8/username.py",
	"id": 622153,
	"parentId": "622152",
	"dateAddedLocal": "2/24/2022, 8:17:34 AM",
	"dateAddedUTC": "2022-02-24T13:17:34.000Z"
},{
	"index": 1,
	"title": "GitHub - sherlock-project/sherlock: 🔎 Hunt down social media accounts by username across social networks",
	"url": "https://github.com/sherlock-project/sherlock.git",
	"id": 622154,
	"parentId": "622152",
	"dateAddedLocal": "2/24/2022, 8:17:34 AM",
	"dateAddedUTC": "2022-02-24T13:17:34.000Z"
},{
	"index": 2,
	"title": "HA71/Namechk",
	"url": "https://github.com/HA71/Namechk",
	"id": 622155,
	"parentId": "622152",
	"dateAddedLocal": "2/24/2022, 8:17:34 AM",
	"dateAddedUTC": "2022-02-24T13:17:34.000Z"
},{
	"index": 9,
	"title": "Phone Number Recon",
	"id": 622156,
	"parentId": "622098",
	"dateAddedLocal": "10/25/2022, 12:34:39 PM",
	"dateAddedUTC": "2022-10-25T16:34:39.304Z"
},{
	"index": 0,
	"title": "GitHub - sundowndev/PhoneInfoga: Advanced information gathering & OSINT tool for phone numbers",
	"url": "https://github.com/sundowndev/PhoneInfoga.git",
	"id": 622157,
	"parentId": "622156",
	"dateAddedLocal": "2/24/2022, 8:17:34 AM",
	"dateAddedUTC": "2022-02-24T13:17:34.000Z"
},{
	"index": 10,
	"title": "Recon-NG",
	"id": 622158,
	"parentId": "622098",
	"dateAddedLocal": "10/25/2022, 12:34:39 PM",
	"dateAddedUTC": "2022-10-25T16:34:39.304Z"
},{
	"index": 0,
	"title": "Recon-ng V5 - YouTube",
	"url": "https://www.youtube.com/playlist?list=PLBf0hzazHTGOg9taK90uFjdcb8UgGfRKZ",
	"id": 622159,
	"parentId": "622158",
	"dateAddedLocal": "2/24/2022, 8:17:34 AM",
	"dateAddedUTC": "2022-02-24T13:17:34.000Z"
},{
	"index": 11,
	"title": "Shodan",
	"id": 622160,
	"parentId": "622098",
	"dateAddedLocal": "10/25/2022, 12:34:39 PM",
	"dateAddedUTC": "2022-10-25T16:34:39.304Z"
},{
	"index": 0,
	"title": "Shodan Help Center",
	"url": "https://help.shodan.io/",
	"id": 622161,
	"parentId": "622160",
	"dateAddedLocal": "2/24/2022, 8:17:34 AM",
	"dateAddedUTC": "2022-02-24T13:17:34.000Z"
},{
	"index": 1,
	"title": "Shodan Pentesting Guide",
	"url": "https://community.turgensec.com/shodan-pentesting-guide",
	"id": 622162,
	"parentId": "622160",
	"dateAddedLocal": "2/24/2022, 8:17:34 AM",
	"dateAddedUTC": "2022-02-24T13:17:34.000Z"
},{
	"index": 2,
	"title": "Shodan Search Engine",
	"url": "https://beta.shodan.io/search/examples",
	"id": 622163,
	"parentId": "622160",
	"dateAddedLocal": "2/24/2022, 8:17:34 AM",
	"dateAddedUTC": "2022-02-24T13:17:34.000Z"
},{
	"index": 12,
	"title": "Sn0int",
	"id": 622164,
	"parentId": "622098",
	"dateAddedLocal": "10/25/2022, 12:34:39 PM",
	"dateAddedUTC": "2022-10-25T16:34:39.304Z"
},{
	"index": 0,
	"title": "kpcyrd/sn0int",
	"url": "https://github.com/kpcyrd/sn0int",
	"id": 622165,
	"parentId": "622164",
	"dateAddedLocal": "2/24/2022, 8:17:34 AM",
	"dateAddedUTC": "2022-02-24T13:17:34.000Z"
},{
	"index": 13,
	"title": "Spiderfoot",
	"id": 622166,
	"parentId": "622098",
	"dateAddedLocal": "10/25/2022, 12:34:39 PM",
	"dateAddedUTC": "2022-10-25T16:34:39.304Z"
},{
	"index": 0,
	"title": "DNS recon with SpiderFoot - asciinema",
	"url": "https://asciinema.org/a/295912",
	"id": 622167,
	"parentId": "622166",
	"dateAddedLocal": "2/24/2022, 8:17:34 AM",
	"dateAddedUTC": "2022-02-24T13:17:34.000Z"
},{
	"index": 1,
	"title": "GitHub - smicallef/spiderfoot: SpiderFoot automates OSINT for threat intelligence and mapping your attack surface.",
	"url": "https://github.com/smicallef/spiderfoot.git",
	"id": 622168,
	"parentId": "622166",
	"dateAddedLocal": "2/24/2022, 8:17:34 AM",
	"dateAddedUTC": "2022-02-24T13:17:34.000Z"
},{
	"index": 14,
	"title": "Telegram",
	"id": 622169,
	"parentId": "622098",
	"dateAddedLocal": "10/25/2022, 12:34:39 PM",
	"dateAddedUTC": "2022-10-25T16:34:39.304Z"
},{
	"index": 0,
	"title": "GitHub - th3unkn0n/TeleGram-Scraper: telegram group scraper tool. fetch all information about group members",
	"url": "https://github.com/th3unkn0n/TeleGram-Scraper",
	"id": 622170,
	"parentId": "622169",
	"dateAddedLocal": "2/24/2022, 8:17:34 AM",
	"dateAddedUTC": "2022-02-24T13:17:34.000Z"
},{
	"index": 15,
	"title": "Twitter",
	"id": 622171,
	"parentId": "622098",
	"dateAddedLocal": "10/25/2022, 12:34:39 PM",
	"dateAddedUTC": "2022-10-25T16:34:39.304Z"
},{
	"index": 0,
	"title": "GitHub - MazenElzanaty/TwLocation: Python script that gets Twitter users' tweets location",
	"url": "https://github.com/MazenElzanaty/TwLocation",
	"id": 622172,
	"parentId": "622171",
	"dateAddedLocal": "2/24/2022, 8:17:34 AM",
	"dateAddedUTC": "2022-02-24T13:17:34.000Z"
},{
	"index": 1,
	"title": "vaguileradiaz/tinfoleak",
	"url": "https://github.com/vaguileradiaz/tinfoleak",
	"id": 622173,
	"parentId": "622171",
	"dateAddedLocal": "2/24/2022, 8:17:34 AM",
	"dateAddedUTC": "2022-02-24T13:17:34.000Z"
},{
	"index": 16,
	"title": "Username Recon",
	"id": 622174,
	"parentId": "622098",
	"dateAddedLocal": "10/25/2022, 12:34:39 PM",
	"dateAddedUTC": "2022-10-25T16:34:39.304Z"
},{
	"index": 0,
	"title": "GitHub - 7rillionaire/Search4: A tool to search a particular username on almost every social platform and tell , whether the user with that username exists on that site or not.",
	"url": "https://github.com/7rillionaire/Search4",
	"id": 622175,
	"parentId": "622174",
	"dateAddedLocal": "2/24/2022, 8:17:34 AM",
	"dateAddedUTC": "2022-02-24T13:17:34.000Z"
},{
	"index": 31,
	"title": "Linux Training",
	"id": 622176,
	"parentId": "622067",
	"dateAddedLocal": "10/25/2022, 12:34:39 PM",
	"dateAddedUTC": "2022-10-25T16:34:39.305Z"
},{
	"index": 0,
	"title": "50 Most Frequently Used UNIX / Linux Commands (With Examples)",
	"url": "https://www.thegeekstuff.com/2010/11/50-linux-commands",
	"id": 622177,
	"parentId": "622176",
	"dateAddedLocal": "2/24/2022, 8:17:34 AM",
	"dateAddedUTC": "2022-02-24T13:17:34.000Z"
},{
	"index": 1,
	"title": "Basic (but) Useful Linux Commands | Bodhi LinuxBasic (but) Useful Linux Commands | Bodhi Linux",
	"url": "https://www.bodhilinux.com/w/basic-but-useful-linux-commands",
	"id": 622178,
	"parentId": "622176",
	"dateAddedLocal": "2/24/2022, 8:17:34 AM",
	"dateAddedUTC": "2022-02-24T13:17:34.000Z"
},{
	"index": 2,
	"title": "HakTip - Linux Terminal 101 - Getting Started - YouTube",
	"url": "https://www.youtube.com/watch?list=PLW5y1tjAOzI2ZYTlMdGzCV8AJuoqW5lKB&v=b5NmtmNwMgU",
	"id": 622179,
	"parentId": "622176",
	"dateAddedLocal": "2/24/2022, 8:17:34 AM",
	"dateAddedUTC": "2022-02-24T13:17:34.000Z"
},{
	"index": 3,
	"title": "Introduction to Linux (LFS101) - Linux Foundation - Training",
	"url": "https://training.linuxfoundation.org/training/introduction-to-linux",
	"id": 622180,
	"parentId": "622176",
	"dateAddedLocal": "2/24/2022, 8:17:34 AM",
	"dateAddedUTC": "2022-02-24T13:17:34.000Z"
},{
	"index": 4,
	"title": "Linux Commands Cheat Sheet | Linux Training Academy",
	"url": "https://www.linuxtrainingacademy.com/linux-commands-cheat-sheet",
	"id": 622181,
	"parentId": "622176",
	"dateAddedLocal": "2/24/2022, 8:17:34 AM",
	"dateAddedUTC": "2022-02-24T13:17:34.000Z"
},{
	"index": 5,
	"title": "Linuxjourney",
	"url": "https://linuxjourney.com/",
	"id": 622182,
	"parentId": "622176",
	"dateAddedLocal": "2/24/2022, 8:17:34 AM",
	"dateAddedUTC": "2022-02-24T13:17:34.000Z"
},{
	"index": 6,
	"title": "Switching From Windows to Nix or a Newbie to Linux - 20 Useful Commands for Linux Newbies",
	"url": "https://www.tecmint.com/useful-linux-commands-for-newbies",
	"id": 622183,
	"parentId": "622176",
	"dateAddedLocal": "2/24/2022, 8:17:34 AM",
	"dateAddedUTC": "2022-02-24T13:17:34.000Z"
},{
	"index": 7,
	"title": "The Linux Documentation Project: Guides",
	"url": "https://www.tldp.org/guides.html",
	"id": 622184,
	"parentId": "622176",
	"dateAddedLocal": "2/24/2022, 8:17:34 AM",
	"dateAddedUTC": "2022-02-24T13:17:34.000Z"
},{
	"index": 8,
	"title": "explainshell.com - sudo apt-get update && sudo apt-get upgrade",
	"url": "https://explainshell.com/explain?cmd=sudo+apt-get+update+%26%26+sudo+apt-get+upgrade",
	"id": 622185,
	"parentId": "622176",
	"dateAddedLocal": "2/24/2022, 8:17:34 AM",
	"dateAddedUTC": "2022-02-24T13:17:34.000Z"
},{
	"index": 9,
	"title": "filetype:pdf linux commands - Google Search",
	"url": "https://www.google.com/search?client=firefox-b-1-d&q=filetype%3Apdf+linux+commands",
	"id": 622186,
	"parentId": "622176",
	"dateAddedLocal": "2/24/2022, 8:17:34 AM",
	"dateAddedUTC": "2022-02-24T13:17:34.000Z"
},{
	"index": 3,
	"title": "OS Other",
	"id": 622187,
	"parentId": "622043",
	"dateAddedLocal": "10/25/2022, 12:34:39 PM",
	"dateAddedUTC": "2022-10-25T16:34:39.305Z"
},{
	"index": 0,
	"title": "CasaOS - A simple, easy-to-use, elegant open-source home cloud system",
	"url": "https://www.casaos.io/",
	"id": 622188,
	"parentId": "622187",
	"dateAddedLocal": "7/6/2022, 10:16:11 AM",
	"dateAddedUTC": "2022-07-06T14:16:11.000Z"
},{
	"index": 1,
	"title": "System76 - Linux Laptops, Desktops, and Servers",
	"url": "https://system76.com/",
	"id": 622189,
	"parentId": "622187",
	"dateAddedLocal": "3/25/2022, 12:20:32 AM",
	"dateAddedUTC": "2022-03-25T04:20:32.000Z"
},{
	"index": 2,
	"title": "Haiku Project",
	"url": "https://www.haiku-os.org/",
	"id": 622190,
	"parentId": "622187",
	"dateAddedLocal": "3/24/2022, 7:59:09 AM",
	"dateAddedUTC": "2022-03-24T11:59:09.000Z"
},{
	"index": 3,
	"title": "Your favorite operating systems in one place! | netboot.xyz",
	"url": "https://www.netboot.xyz/",
	"id": 622191,
	"parentId": "622187",
	"dateAddedLocal": "3/24/2022, 6:49:39 AM",
	"dateAddedUTC": "2022-03-24T10:49:39.000Z"
},{
	"index": 4,
	"title": "PureOS",
	"url": "https://www.pureos.net/",
	"id": 622192,
	"parentId": "622187",
	"dateAddedLocal": "3/24/2022, 6:48:25 AM",
	"dateAddedUTC": "2022-03-24T10:48:25.000Z"
},{
	"index": 5,
	"title": "Front Page",
	"url": "https://reactos.org/",
	"id": 622193,
	"parentId": "622187",
	"dateAddedLocal": "3/17/2022, 8:54:04 PM",
	"dateAddedUTC": "2022-03-18T00:54:04.000Z"
},{
	"index": 6,
	"title": "QEMU",
	"url": "https://www.qemu.org/",
	"id": 622194,
	"parentId": "622187",
	"dateAddedLocal": "3/17/2022, 7:58:49 PM",
	"dateAddedUTC": "2022-03-17T23:58:49.000Z"
},{
	"index": 7,
	"title": "OnWorks Free hosting provider for Linux online",
	"url": "https://www.onworks.net/",
	"id": 622195,
	"parentId": "622187",
	"dateAddedLocal": "3/17/2022, 7:00:01 PM",
	"dateAddedUTC": "2022-03-17T23:00:01.000Z"
},{
	"index": 8,
	"title": "urbit.org",
	"url": "https://urbit.org/",
	"id": 622196,
	"parentId": "622187",
	"dateAddedLocal": "11/22/2021, 4:08:09 PM",
	"dateAddedUTC": "2021-11-22T21:08:09.000Z"
},{
	"index": 9,
	"title": "skiftOS",
	"url": "https://skiftos.org/",
	"id": 622197,
	"parentId": "622187",
	"dateAddedLocal": "1/17/2022, 11:38:25 PM",
	"dateAddedUTC": "2022-01-18T04:38:25.000Z"
},{
	"index": 4,
	"title": "Software",
	"id": 631230,
	"parentId": "622043",
	"dateAddedLocal": "10/25/2022, 12:34:39 PM",
	"dateAddedUTC": "2022-10-25T16:34:39.602Z"
},{
	"index": 0,
	"title": "Hackintosh",
	"id": 631231,
	"parentId": "631230",
	"dateAddedLocal": "10/25/2022, 12:34:39 PM",
	"dateAddedUTC": "2022-10-25T16:34:39.602Z"
},{
	"index": 0,
	"title": "Apps | AppDn Category - Mac OSX",
	"url": "https://appdn.net/category/apps",
	"id": 631232,
	"parentId": "631231",
	"dateAddedLocal": "2/24/2022, 8:17:34 AM",
	"dateAddedUTC": "2022-02-24T13:17:34.000Z"
},{
	"index": 1,
	"title": "Downloads - HackintoshOSX.com",
	"url": "https://www.hackintoshosx.com/",
	"id": 631233,
	"parentId": "631231",
	"dateAddedLocal": "2/24/2022, 8:17:34 AM",
	"dateAddedUTC": "2022-02-24T13:17:34.000Z"
},{
	"index": 2,
	"title": "Choose the best model number on your Hackintosh for correct power management | GiulioMac",
	"url": "https://giuliomac.wordpress.com/2014/02/21/best-model-number-on-your-hackintosh",
	"id": 631234,
	"parentId": "631231",
	"dateAddedLocal": "2/24/2022, 8:17:34 AM",
	"dateAddedUTC": "2022-02-24T13:17:34.000Z"
},{
	"index": 3,
	"title": "Guide :: Install Mac OSX El Capitan on Hackintosh PC With Chameleon Bootloader [ Vanilla Installation Method ] - OSXARENA OSXARENA",
	"url": "https://osxarena.com/2015/10/guide-install-el-capitan-on-hackintosh-pc-with-chameleon-bootloader-vanilla-installation-method",
	"id": 631235,
	"parentId": "631231",
	"dateAddedLocal": "2/24/2022, 8:17:34 AM",
	"dateAddedUTC": "2022-02-24T13:17:34.000Z"
},{
	"index": 4,
	"title": "Hackintosh",
	"url": "https://www.reddit.com/r/hackintosh",
	"id": 631236,
	"parentId": "631231",
	"dateAddedLocal": "2/24/2022, 8:17:34 AM",
	"dateAddedUTC": "2022-02-24T13:17:34.000Z"
},{
	"index": 5,
	"title": "Hackintosh won't boot? Here's how you can use verbose mode to fix it.",
	"url": "https://www.macbreaker.com/2015/01/read-verbose-mode-fix-hackintosh-errors.html",
	"id": 631237,
	"parentId": "631231",
	"dateAddedLocal": "2/24/2022, 8:17:34 AM",
	"dateAddedUTC": "2022-02-24T13:17:34.000Z"
},{
	"index": 6,
	"title": "How to Install OS X Mavericks using Clover",
	"url": "https://www.tonymacx86.com/mavericks-desktop-guides/125632-how-install-os-x-mavericks-using-clover.html",
	"id": 631238,
	"parentId": "631231",
	"dateAddedLocal": "2/24/2022, 8:17:34 AM",
	"dateAddedUTC": "2022-02-24T13:17:34.000Z"
},{
	"index": 7,
	"title": "How to find a working serial number for your Hackintosh | GiulioMac",
	"url": "https://giuliomac.wordpress.com/2014/02/18/how-to-find-a-working-serial-number-for-your-hackintosh",
	"id": 631239,
	"parentId": "631231",
	"dateAddedLocal": "2/24/2022, 8:17:34 AM",
	"dateAddedUTC": "2022-02-24T13:17:34.000Z"
},{
	"index": 8,
	"title": "InsanelyMac Forum",
	"url": "https://www.insanelymac.com/forum",
	"id": 631240,
	"parentId": "631231",
	"dateAddedLocal": "2/24/2022, 8:17:34 AM",
	"dateAddedUTC": "2022-02-24T13:17:34.000Z"
},{
	"index": 9,
	"title": "Mac Hacks, Tweaks, Themes & Mac Case Mods @ MacHacks.com",
	"url": "https://www.machacks.com/#mac_hacks",
	"id": 631241,
	"parentId": "631231",
	"dateAddedLocal": "2/24/2022, 8:17:34 AM",
	"dateAddedUTC": "2022-02-24T13:17:34.000Z"
},{
	"index": 10,
	"title": "Mac Tips, Tricks & Mods",
	"url": "https://modmyi.com/forums/mac-tips-tricks-and-mods",
	"id": 631242,
	"parentId": "631231",
	"dateAddedLocal": "2/24/2022, 8:17:34 AM",
	"dateAddedUTC": "2022-02-24T13:17:34.000Z"
},{
	"index": 11,
	"title": "Macintosh Garden",
	"url": "https://macintoshgarden.org/",
	"id": 631243,
	"parentId": "631231",
	"dateAddedLocal": "2/24/2022, 8:17:34 AM",
	"dateAddedUTC": "2022-02-24T13:17:34.000Z"
},{
	"index": 12,
	"title": "NMac.to",
	"url": "https://nmac.to/",
	"id": 631244,
	"parentId": "631231",
	"dateAddedLocal": "2/24/2022, 8:17:34 AM",
	"dateAddedUTC": "2022-02-24T13:17:34.000Z"
},{
	"index": 13,
	"title": "OS X 10.9.5 Update",
	"url": "https://www.tonymacx86.com/442-os-x-10-9-5-update.html",
	"id": 631245,
	"parentId": "631231",
	"dateAddedLocal": "2/24/2022, 8:17:34 AM",
	"dateAddedUTC": "2022-02-24T13:17:34.000Z"
},{
	"index": 14,
	"title": "OS X Mavericks 10.9.5 Update (Combo)",
	"url": "https://support.apple.com/kb/DL1760",
	"id": 631246,
	"parentId": "631231",
	"dateAddedLocal": "2/24/2022, 8:17:34 AM",
	"dateAddedUTC": "2022-02-24T13:17:34.000Z"
},{
	"index": 15,
	"title": "Skyline OSX - Hackintosh Resources and Guides",
	"url": "https://www.skylineosx.com/",
	"id": 631247,
	"parentId": "631231",
	"dateAddedLocal": "2/24/2022, 8:17:34 AM",
	"dateAddedUTC": "2022-02-24T13:17:34.000Z"
},{
	"index": 16,
	"title": "Swift Programming from Scratch in 100 Exercises - We ❤ Swift",
	"url": "https://www.weheartswift.com/swift-programming-scratch-100-exercises",
	"id": 631248,
	"parentId": "631231",
	"dateAddedLocal": "2/24/2022, 8:17:34 AM",
	"dateAddedUTC": "2022-02-24T13:17:34.000Z"
},{
	"index": 17,
	"title": "View App",
	"url": "https://www.macappfans.org/",
	"id": 631249,
	"parentId": "631231",
	"dateAddedLocal": "2/24/2022, 8:17:34 AM",
	"dateAddedUTC": "2022-02-24T13:17:34.000Z"
},{
	"index": 18,
	"title": "[Guide] AIO Guides For Hackintosh - Tutorials (The Genius Bar) - InsanelyMac Forum",
	"url": "https://www.insanelymac.com/forum/topic/298027-guide-aio-guides-for-hackintosh",
	"id": 631250,
	"parentId": "631231",
	"dateAddedLocal": "2/24/2022, 8:17:34 AM",
	"dateAddedUTC": "2022-02-24T13:17:34.000Z"
},{
	"index": 19,
	"title": "tonymacx86.com",
	"url": "https://www.tonymacx86.com/home.php",
	"id": 631251,
	"parentId": "631231",
	"dateAddedLocal": "2/24/2022, 8:17:34 AM",
	"dateAddedUTC": "2022-02-24T13:17:34.000Z"
},{
	"index": 20,
	"title": "www.tonymacx86.com/lion-desktop-support/103977-ebios-read-error-controller-device-error-block-0x0-sectors-0-a-2.html",
	"url": "https://www.tonymacx86.com/lion-desktop-support/103977-ebios-read-error-controller-device-error-block-0x0-sectors-0-a-2.html",
	"id": 631252,
	"parentId": "631231",
	"dateAddedLocal": "2/24/2022, 8:17:34 AM",
	"dateAddedUTC": "2022-02-24T13:17:34.000Z"
},{
	"index": 1,
	"title": "Mac Apps",
	"id": 631253,
	"parentId": "631230",
	"dateAddedLocal": "10/25/2022, 12:34:39 PM",
	"dateAddedUTC": "2022-10-25T16:34:39.603Z"
},{
	"index": 0,
	"title": "Flow — The Mac's Best FTP + SFTP Client",
	"url": "http://fivedetails.com/flow/",
	"id": 631254,
	"parentId": "631253",
	"dateAddedLocal": "6/22/2022, 11:25:59 PM",
	"dateAddedUTC": "2022-06-23T03:25:59.000Z"
},{
	"index": 1,
	"title": "Open-source data multitool | VisiData",
	"url": "https://www.visidata.org/",
	"id": 631255,
	"parentId": "631253",
	"dateAddedLocal": "6/22/2022, 11:24:19 PM",
	"dateAddedUTC": "2022-06-23T03:24:19.000Z"
},{
	"index": 2,
	"title": "Spaceship",
	"url": "https://spaceship-prompt.sh/",
	"id": 631256,
	"parentId": "631253",
	"dateAddedLocal": "6/22/2022, 11:23:14 PM",
	"dateAddedUTC": "2022-06-23T03:23:14.000Z"
},{
	"index": 3,
	"title": "Tabby - a terminal for a more modern age",
	"url": "https://tabby.sh/",
	"id": 631257,
	"parentId": "631253",
	"dateAddedLocal": "6/22/2022, 11:22:30 PM",
	"dateAddedUTC": "2022-06-23T03:22:30.000Z"
},{
	"index": 4,
	"title": "MacTechnologies Consulting (914) 500-8878",
	"url": "http://www.mactechnologies.com/index.php?page=downloads#regexrx",
	"id": 631258,
	"parentId": "631253",
	"dateAddedLocal": "6/22/2022, 11:19:03 PM",
	"dateAddedUTC": "2022-06-23T03:19:03.000Z"
},{
	"index": 5,
	"title": "SwitchHosts - swh.app",
	"url": "https://swh.app/",
	"id": 631259,
	"parentId": "631253",
	"dateAddedLocal": "6/22/2022, 11:17:23 PM",
	"dateAddedUTC": "2022-06-23T03:17:23.000Z"
},{
	"index": 6,
	"title": "PushMate",
	"url": "https://pushmate.app/",
	"id": 631260,
	"parentId": "631253",
	"dateAddedLocal": "6/22/2022, 11:15:54 PM",
	"dateAddedUTC": "2022-06-23T03:15:54.000Z"
},{
	"index": 7,
	"title": "Hex Fiend, a fast and clever hex editor for macOS",
	"url": "https://hexfiend.com/",
	"id": 631261,
	"parentId": "631253",
	"dateAddedLocal": "6/22/2022, 11:14:53 PM",
	"dateAddedUTC": "2022-06-23T03:14:53.000Z"
},{
	"index": 8,
	"title": "Bidbar - Save and run Terminal commands from the menu bar",
	"url": "https://www.getbidbar.com/",
	"id": 631262,
	"parentId": "631253",
	"dateAddedLocal": "6/22/2022, 11:13:37 PM",
	"dateAddedUTC": "2022-06-23T03:13:37.000Z"
},{
	"index": 9,
	"title": "Tad",
	"url": "https://www.tadviewer.com/",
	"id": 631263,
	"parentId": "631253",
	"dateAddedLocal": "6/22/2022, 11:11:58 PM",
	"dateAddedUTC": "2022-06-23T03:11:58.000Z"
},{
	"index": 10,
	"title": "Onivim 2 - Modal Editing from the Future",
	"url": "https://www.onivim.io/",
	"id": 631264,
	"parentId": "631253",
	"dateAddedLocal": "6/22/2022, 11:07:41 PM",
	"dateAddedUTC": "2022-06-23T03:07:41.000Z"
},{
	"index": 11,
	"title": "‎TelepaText - editor, speech",
	"url": "https://apps.apple.com/us/app/telepatext-editor-speech/id908007516?mt=12",
	"id": 631265,
	"parentId": "631253",
	"dateAddedLocal": "6/9/2022, 10:26:33 AM",
	"dateAddedUTC": "2022-06-09T14:26:33.000Z"
},{
	"index": 12,
	"title": "‎Wunderbucket",
	"url": "https://apps.apple.com/us/app/wunderbucket/id1545630520?mt=12",
	"id": 631266,
	"parentId": "631253",
	"dateAddedLocal": "5/11/2022, 9:17:39 PM",
	"dateAddedUTC": "2022-05-12T01:17:39.000Z"
},{
	"index": 13,
	"title": "‎Snippets Library",
	"url": "https://apps.apple.com/us/app/snippets-library/id1585687204?mt=12",
	"id": 631267,
	"parentId": "631253",
	"dateAddedLocal": "5/11/2022, 9:05:44 PM",
	"dateAddedUTC": "2022-05-12T01:05:44.000Z"
},{
	"index": 14,
	"title": "‎TextLab",
	"url": "https://apps.apple.com/us/app/textlab/id1024903185?mt=12",
	"id": 631268,
	"parentId": "631253",
	"dateAddedLocal": "5/11/2022, 8:58:10 PM",
	"dateAddedUTC": "2022-05-12T00:58:10.000Z"
},{
	"index": 15,
	"title": "‎DevUtils.app",
	"url": "https://apps.apple.com/us/app/devutils-app/id1533756032?mt=12",
	"id": 631269,
	"parentId": "631253",
	"dateAddedLocal": "5/11/2022, 8:55:42 PM",
	"dateAddedUTC": "2022-05-12T00:55:42.000Z"
},{
	"index": 16,
	"title": "‎MarkDownload",
	"url": "https://apps.apple.com/us/app/markdownload/id1554029832?mt=12",
	"id": 631270,
	"parentId": "631253",
	"dateAddedLocal": "5/11/2022, 8:54:51 PM",
	"dateAddedUTC": "2022-05-12T00:54:51.000Z"
},{
	"index": 17,
	"title": "‎Power YAML Editor",
	"url": "https://apps.apple.com/us/app/power-yaml-editor/id1565766176?mt=12",
	"id": 631271,
	"parentId": "631253",
	"dateAddedLocal": "5/11/2022, 8:54:12 PM",
	"dateAddedUTC": "2022-05-12T00:54:12.000Z"
},{
	"index": 18,
	"title": "‎TextLab 2",
	"url": "https://apps.apple.com/us/app/textlab-2/id1582888285?mt=12",
	"id": 631272,
	"parentId": "631253",
	"dateAddedLocal": "5/11/2022, 8:52:49 PM",
	"dateAddedUTC": "2022-05-12T00:52:49.000Z"
},{
	"index": 19,
	"title": "‎HandyText Tool",
	"url": "https://apps.apple.com/us/app/handytext-tool/id1596294097?mt=12",
	"id": 631273,
	"parentId": "631253",
	"dateAddedLocal": "5/11/2022, 8:51:45 PM",
	"dateAddedUTC": "2022-05-12T00:51:45.000Z"
},{
	"index": 20,
	"title": "‎OwlOCR - Screenshot to Text",
	"url": "https://apps.apple.com/us/app/owlocr-screenshot-to-text/id1499181666?mt=12",
	"id": 631274,
	"parentId": "631253",
	"dateAddedLocal": "1/26/2022, 8:33:16 PM",
	"dateAddedUTC": "2022-01-27T01:33:16.000Z"
},{
	"index": 21,
	"title": "Print Window 5",
	"url": "http://www.searchwaresolutions.com/",
	"id": 631275,
	"parentId": "631253",
	"dateAddedLocal": "1/24/2022, 12:24:13 PM",
	"dateAddedUTC": "2022-01-24T17:24:13.000Z"
},{
	"index": 22,
	"title": "‎Backtrack - Record Past Audio",
	"url": "https://apps.apple.com/us/app/backtrack-record-past-audio/id1477089520?mt=12",
	"id": 631276,
	"parentId": "631253",
	"dateAddedLocal": "1/20/2022, 11:54:18 AM",
	"dateAddedUTC": "2022-01-20T16:54:18.000Z"
},{
	"index": 23,
	"title": "Manipulist",
	"url": "https://apps.apple.com/gb/app/manipulist/id1577983405",
	"id": 631277,
	"parentId": "631253",
	"dateAddedLocal": "12/21/2021, 6:52:55 AM",
	"dateAddedUTC": "2021-12-21T11:52:55.000Z"
},{
	"index": 24,
	"title": "DB Browser for SQLite",
	"url": "https://sqlitebrowser.org/",
	"id": 631278,
	"parentId": "631253",
	"dateAddedLocal": "1/17/2022, 11:38:25 PM",
	"dateAddedUTC": "2022-01-18T04:38:25.000Z"
},{
	"index": 25,
	"title": "Espanso - A Privacy-first, Cross-platform Text Expander",
	"url": "https://espanso.org/",
	"id": 631279,
	"parentId": "631253",
	"dateAddedLocal": "1/17/2022, 11:38:25 PM",
	"dateAddedUTC": "2022-01-18T04:38:25.000Z"
},{
	"index": 26,
	"title": "ghostwriter",
	"url": "https://wereturtle.github.io/ghostwriter",
	"id": 631280,
	"parentId": "631253",
	"dateAddedLocal": "1/17/2022, 11:38:25 PM",
	"dateAddedUTC": "2022-01-18T04:38:25.000Z"
},{
	"index": 27,
	"title": "ueli - A keystroke launcher for Windows and macOS",
	"url": "https://ueli.app/#/",
	"id": 631281,
	"parentId": "631253",
	"dateAddedLocal": "1/18/2022, 8:14:39 AM",
	"dateAddedUTC": "2022-01-18T13:14:39.000Z"
},{
	"index": 28,
	"title": "Keyboard Maestro 10.0.2: Work Faster with Macros for macOS",
	"url": "https://www.keyboardmaestro.com/main/",
	"id": 631282,
	"parentId": "631253",
	"dateAddedLocal": "1/17/2022, 5:03:34 PM",
	"dateAddedUTC": "2022-01-17T22:03:34.000Z"
},{
	"index": 29,
	"title": "OSX",
	"id": 631283,
	"parentId": "631253",
	"dateAddedLocal": "10/25/2022, 12:34:39 PM",
	"dateAddedUTC": "2022-10-25T16:34:39.604Z"
},{
	"index": 0,
	"title": "XMac.App",
	"url": "https://xmac.app/",
	"id": 631284,
	"parentId": "631283",
	"dateAddedLocal": "10/25/2022, 11:09:03 AM",
	"dateAddedUTC": "2022-10-25T15:09:03.000Z"
},{
	"index": 1,
	"title": "For MacOSX » OneDDL - Download All You Want",
	"url": "https://oneddl.org/software/for-macosx/",
	"id": 631285,
	"parentId": "631283",
	"dateAddedLocal": "10/1/2022, 1:29:41 AM",
	"dateAddedUTC": "2022-10-01T05:29:41.000Z"
},{
	"index": 2,
	"title": "Download Free Mac Software & Games - Download.io",
	"url": "https://www.download.io/mac/",
	"id": 631286,
	"parentId": "631283",
	"dateAddedLocal": "9/27/2022, 5:04:04 PM",
	"dateAddedUTC": "2022-09-27T21:04:04.000Z"
},{
	"index": 3,
	"title": "GetinMac - Download Free Your Desired Mac OS Apps",
	"url": "https://getinmac.com/",
	"id": 631287,
	"parentId": "631283",
	"dateAddedLocal": "5/17/2022, 4:48:13 PM",
	"dateAddedUTC": "2022-05-17T20:48:13.000Z"
},{
	"index": 4,
	"title": "MacDrop - Cracked Mac Apps & Games",
	"url": "https://macdrop.net/",
	"id": 631288,
	"parentId": "631283",
	"dateAddedLocal": "2/24/2022, 8:17:34 AM",
	"dateAddedUTC": "2022-02-24T13:17:34.000Z"
},{
	"index": 5,
	"title": "NXMac Ked - Mac OSX Apps & Games Download",
	"url": "https://nxmac.com/",
	"id": 631289,
	"parentId": "631283",
	"dateAddedLocal": "2/24/2022, 8:17:34 AM",
	"dateAddedUTC": "2022-02-24T13:17:34.000Z"
},{
	"index": 6,
	"title": "MacOS apps, utilities and programs Free Download - FileCR",
	"url": "https://filecr.com/macos?id=260042742353",
	"id": 631290,
	"parentId": "631283",
	"dateAddedLocal": "9/24/2022, 10:44:01 PM",
	"dateAddedUTC": "2022-09-25T02:44:01.000Z"
},{
	"index": 7,
	"title": "Download software for Mac",
	"url": "https://en.softonic.com/mac",
	"id": 631291,
	"parentId": "631283",
	"dateAddedLocal": "9/24/2022, 10:43:38 PM",
	"dateAddedUTC": "2022-09-25T02:43:38.000Z"
},{
	"index": 8,
	"title": "macOS Crack - Cracked Mac Apps & Games",
	"url": "https://macbff.com/page/2",
	"id": 631292,
	"parentId": "631283",
	"dateAddedLocal": "2/24/2022, 8:17:34 AM",
	"dateAddedUTC": "2022-02-24T13:17:34.000Z"
},{
	"index": 9,
	"title": "AppStorrent - Games and software for Mac (macOS Big Sur)",
	"url": "https://appstorrent.ru/",
	"id": 631293,
	"parentId": "631283",
	"dateAddedLocal": "2/24/2022, 8:17:34 AM",
	"dateAddedUTC": "2022-02-24T13:17:34.000Z"
},{
	"index": 10,
	"title": "For MacOSX » Downarchive",
	"url": "https://downarchive.org/software/for-macosx",
	"id": 631294,
	"parentId": "631283",
	"dateAddedLocal": "2/24/2022, 8:17:34 AM",
	"dateAddedUTC": "2022-02-24T13:17:34.000Z"
},{
	"index": 11,
	"title": "Haxmac | Cracked Mac Apps Store",
	"url": "https://haxmac.cc/",
	"id": 631295,
	"parentId": "631283",
	"dateAddedLocal": "2/24/2022, 8:17:34 AM",
	"dateAddedUTC": "2022-02-24T13:17:34.000Z"
},{
	"index": 12,
	"title": "Mac Torrent Download - Torrents for Mac Apps, Games, Plugins",
	"url": "https://mac-torrent-download.net/",
	"id": 631296,
	"parentId": "631283",
	"dateAddedLocal": "2/24/2022, 8:17:34 AM",
	"dateAddedUTC": "2022-02-24T13:17:34.000Z"
},{
	"index": 13,
	"title": "MacOS apps, utilities and programs Free Download - FileCR",
	"url": "https://filecr.com/macos?id=182231459338",
	"id": 631297,
	"parentId": "631283",
	"dateAddedLocal": "2/24/2022, 8:17:34 AM",
	"dateAddedUTC": "2022-02-24T13:17:34.000Z"
},{
	"index": 14,
	"title": "[ Mac Software ] | AppNee Freeware Group.",
	"url": "https://appnee.com/category/mac-software",
	"id": 631298,
	"parentId": "631283",
	"dateAddedLocal": "2/24/2022, 8:17:34 AM",
	"dateAddedUTC": "2022-02-24T13:17:34.000Z"
},{
	"index": 15,
	"title": "MacOS - Scnlog.me",
	"url": "https://scnlog.me/apps/macos",
	"id": 631299,
	"parentId": "631283",
	"dateAddedLocal": "2/24/2022, 8:17:34 AM",
	"dateAddedUTC": "2022-02-24T13:17:34.000Z"
},{
	"index": 16,
	"title": "Applications macOS - SoftArchive",
	"url": "https://sanet.st/applications/filter/page-1?subcategory%5B0%5D=mac-software",
	"id": 631300,
	"parentId": "631283",
	"dateAddedLocal": "9/24/2022, 10:39:40 PM",
	"dateAddedUTC": "2022-09-25T02:39:40.000Z"
},{
	"index": 17,
	"title": "Software for Mac OS X",
	"url": "https://audioz.download/software/mac/",
	"id": 631301,
	"parentId": "631283",
	"dateAddedLocal": "8/10/2022, 4:12:42 PM",
	"dateAddedUTC": "2022-08-10T20:12:42.000Z"
},{
	"index": 18,
	"title": "Best Open Source Mac Software 2022",
	"url": "https://sourceforge.net/directory/os:mac/",
	"id": 631302,
	"parentId": "631283",
	"dateAddedLocal": "8/10/2022, 4:12:42 PM",
	"dateAddedUTC": "2022-08-10T20:12:42.000Z"
},{
	"index": 19,
	"title": "macapps.link · Get Mac apps automatically (like Ninite for Mac)",
	"url": "https://macapps.link/",
	"id": 631303,
	"parentId": "631283",
	"dateAddedLocal": "8/10/2022, 4:12:42 PM",
	"dateAddedUTC": "2022-08-10T20:12:42.000Z"
},{
	"index": 20,
	"title": "Mac Informer - Application downloads and editorial reviews for macOS",
	"url": "https://macdownload.informer.com/",
	"id": 631304,
	"parentId": "631283",
	"dateAddedLocal": "8/10/2022, 4:12:42 PM",
	"dateAddedUTC": "2022-08-10T20:12:42.000Z"
},{
	"index": 21,
	"title": "Cmacked - Cracked Mac Apps & Games",
	"url": "https://apps.cmacked.com/",
	"id": 631305,
	"parentId": "631283",
	"dateAddedLocal": "8/10/2022, 4:12:42 PM",
	"dateAddedUTC": "2022-08-10T20:12:42.000Z"
},{
	"index": 22,
	"title": "Cracked iOS & Mac App Store Apps Free Download | AppCake",
	"url": "https://www.iphonecake.com/",
	"id": 631306,
	"parentId": "631283",
	"dateAddedLocal": "8/10/2022, 4:12:42 PM",
	"dateAddedUTC": "2022-08-10T20:12:42.000Z"
},{
	"index": 23,
	"title": "All Mac World - MAC Apps One Click Away",
	"url": "https://allmacworld.com/",
	"id": 631307,
	"parentId": "631283",
	"dateAddedLocal": "8/10/2022, 4:12:42 PM",
	"dateAddedUTC": "2022-08-10T20:12:42.000Z"
},{
	"index": 24,
	"title": "NXMac Ked - Mac OSX Apps & Games Download - Mac Games - Apps - Downloads",
	"url": "https://nxmac.com/main/",
	"id": 631308,
	"parentId": "631283",
	"dateAddedLocal": "8/10/2022, 4:12:42 PM",
	"dateAddedUTC": "2022-08-10T20:12:42.000Z"
},{
	"index": 25,
	"title": "MacUpdate | Download Best Mac Software | 30,000+ Free Apps",
	"url": "https://www.macupdate.com/",
	"id": 631309,
	"parentId": "631283",
	"dateAddedLocal": "8/10/2022, 4:12:42 PM",
	"dateAddedUTC": "2022-08-10T20:12:42.000Z"
},{
	"index": 2,
	"title": "Mobile Apps",
	"id": 631310,
	"parentId": "631230",
	"dateAddedLocal": "10/25/2022, 12:34:39 PM",
	"dateAddedUTC": "2022-10-25T16:34:39.605Z"
},{
	"index": 0,
	"title": "Appscope",
	"url": "https://appsco.pe/",
	"id": 631311,
	"parentId": "631310",
	"dateAddedLocal": "3/3/2022, 4:23:14 PM",
	"dateAddedUTC": "2022-03-03T21:23:14.000Z"
},{
	"index": 1,
	"title": "‎Writemator",
	"url": "https://apps.apple.com/us/app/writemator/id1326574914",
	"id": 631312,
	"parentId": "631310",
	"dateAddedLocal": "12/28/2021, 12:32:43 AM",
	"dateAddedUTC": "2021-12-28T05:32:43.000Z"
},{
	"index": 2,
	"title": "Android",
	"id": 631313,
	"parentId": "631310",
	"dateAddedLocal": "10/25/2022, 12:34:39 PM",
	"dateAddedUTC": "2022-10-25T16:34:39.605Z"
},{
	"index": 0,
	"title": "chrisknepper/android-messages-desktop at producthunt",
	"url": "https://github.com/chrisknepper/android-messages-desktop?ref=producthunt",
	"id": 631314,
	"parentId": "631313",
	"dateAddedLocal": "12/16/2021, 8:51:13 PM",
	"dateAddedUTC": "2021-12-17T01:51:13.000Z"
},{
	"index": 3,
	"title": "iOS Apps",
	"id": 631315,
	"parentId": "631310",
	"dateAddedLocal": "10/25/2022, 12:34:39 PM",
	"dateAddedUTC": "2022-10-25T16:34:39.605Z"
},{
	"index": 0,
	"title": "Download and sideload Cracked iOS Games and Apps for Free Without Jailbreak with signing service. Cracked macOS Games, Apps. Books for iPhone, iPad and macOS - appdb",
	"url": "https://appdb.to/",
	"id": 631316,
	"parentId": "631315",
	"dateAddedLocal": "9/24/2022, 11:57:28 PM",
	"dateAddedUTC": "2022-09-25T03:57:28.000Z"
},{
	"index": 1,
	"title": "‎Shortcutify",
	"url": "https://apps.apple.com/us/app/shortcutify/id1477222244",
	"id": 631317,
	"parentId": "631315",
	"dateAddedLocal": "2/27/2022, 1:52:36 AM",
	"dateAddedUTC": "2022-02-27T06:52:36.000Z"
},{
	"index": 2,
	"title": "‎Puffery",
	"url": "https://apps.apple.com/us/app/puffery/id1508776889",
	"id": 631318,
	"parentId": "631315",
	"dateAddedLocal": "2/27/2022, 1:50:28 AM",
	"dateAddedUTC": "2022-02-27T06:50:28.000Z"
},{
	"index": 3,
	"title": "‎Splash - Programming Language",
	"url": "https://apps.apple.com/us/app/splash-programming-language/id1455793030",
	"id": 631319,
	"parentId": "631315",
	"dateAddedLocal": "2/27/2022, 1:50:09 AM",
	"dateAddedUTC": "2022-02-27T06:50:09.000Z"
},{
	"index": 4,
	"title": "‎Taio - Markdown & Text Actions",
	"url": "https://apps.apple.com/us/app/taio-markdown-text-actions/id1527036273",
	"id": 631320,
	"parentId": "631315",
	"dateAddedLocal": "2/27/2022, 1:49:36 AM",
	"dateAddedUTC": "2022-02-27T06:49:36.000Z"
},{
	"index": 5,
	"title": "‎Termius: Terminal & SSH client",
	"url": "https://apps.apple.com/us/app/termius-terminal-ssh-client/id549039908",
	"id": 631321,
	"parentId": "631315",
	"dateAddedLocal": "2/27/2022, 1:48:47 AM",
	"dateAddedUTC": "2022-02-27T06:48:47.000Z"
},{
	"index": 6,
	"title": "‎Bear - Markdown Notes",
	"url": "https://apps.apple.com/us/app/bear-markdown-notes/id1016366447",
	"id": 631322,
	"parentId": "631315",
	"dateAddedLocal": "2/27/2022, 1:48:06 AM",
	"dateAddedUTC": "2022-02-27T06:48:06.000Z"
},{
	"index": 7,
	"title": "‎ScriptWidget",
	"url": "https://apps.apple.com/us/app/scriptwidget/id1555600758",
	"id": 631323,
	"parentId": "631315",
	"dateAddedLocal": "2/27/2022, 1:47:06 AM",
	"dateAddedUTC": "2022-02-27T06:47:06.000Z"
},{
	"index": 8,
	"title": "‎a-Shell",
	"url": "https://apps.apple.com/us/app/a-shell/id1473805438",
	"id": 631324,
	"parentId": "631315",
	"dateAddedLocal": "2/27/2022, 1:46:15 AM",
	"dateAddedUTC": "2022-02-27T06:46:15.000Z"
},{
	"index": 9,
	"title": "‎Jellycuts",
	"url": "https://apps.apple.com/us/app/jellycuts/id1522625245",
	"id": 631325,
	"parentId": "631315",
	"dateAddedLocal": "2/27/2022, 1:45:44 AM",
	"dateAddedUTC": "2022-02-27T06:45:44.000Z"
},{
	"index": 10,
	"title": "‎Clone - Git client advanced",
	"url": "https://apps.apple.com/us/app/clone-git-client-advanced/id1037881290",
	"id": 631326,
	"parentId": "631315",
	"dateAddedLocal": "2/27/2022, 1:44:12 AM",
	"dateAddedUTC": "2022-02-27T06:44:12.000Z"
},{
	"index": 11,
	"title": "‎inShort",
	"url": "https://apps.apple.com/us/app/inshort/id423213182",
	"id": 631327,
	"parentId": "631315",
	"dateAddedLocal": "2/27/2022, 1:42:54 AM",
	"dateAddedUTC": "2022-02-27T06:42:54.000Z"
},{
	"index": 12,
	"title": "‎DeDuplicate - Clean Your Cloud",
	"url": "https://apps.apple.com/us/app/deduplicate-clean-your-cloud/id1595129686",
	"id": 631328,
	"parentId": "631315",
	"dateAddedLocal": "2/27/2022, 1:42:06 AM",
	"dateAddedUTC": "2022-02-27T06:42:06.000Z"
},{
	"index": 13,
	"title": "‎a-Shell mini",
	"url": "https://apps.apple.com/us/app/a-shell-mini/id1543537943",
	"id": 631329,
	"parentId": "631315",
	"dateAddedLocal": "2/27/2022, 1:41:38 AM",
	"dateAddedUTC": "2022-02-27T06:41:38.000Z"
},{
	"index": 14,
	"title": "‎Markdown Tables",
	"url": "https://apps.apple.com/us/app/markdown-tables/id1476068521",
	"id": 631330,
	"parentId": "631315",
	"dateAddedLocal": "2/27/2022, 1:40:29 AM",
	"dateAddedUTC": "2022-02-27T06:40:29.000Z"
},{
	"index": 15,
	"title": "‎FSNotes Manager",
	"url": "https://apps.apple.com/us/app/fsnotes-manager/id1346501102",
	"id": 631331,
	"parentId": "631315",
	"dateAddedLocal": "2/27/2022, 1:40:09 AM",
	"dateAddedUTC": "2022-02-27T06:40:09.000Z"
},{
	"index": 16,
	"title": "‎Secure ShellFish",
	"url": "https://apps.apple.com/us/app/secure-shellfish/id1336634154",
	"id": 631332,
	"parentId": "631315",
	"dateAddedLocal": "2/27/2022, 1:39:28 AM",
	"dateAddedUTC": "2022-02-27T06:39:28.000Z"
},{
	"index": 17,
	"title": "‎iSH Shell",
	"url": "https://apps.apple.com/us/app/ish-shell/id1436902243",
	"id": 631333,
	"parentId": "631315",
	"dateAddedLocal": "2/27/2022, 1:38:44 AM",
	"dateAddedUTC": "2022-02-27T06:38:44.000Z"
},{
	"index": 18,
	"title": "‎API Brew",
	"url": "https://apps.apple.com/us/app/api-brew/id1586236862",
	"id": 631334,
	"parentId": "631315",
	"dateAddedLocal": "2/27/2022, 1:38:15 AM",
	"dateAddedUTC": "2022-02-27T06:38:15.000Z"
},{
	"index": 19,
	"title": "‎Pushover Notifications",
	"url": "https://apps.apple.com/us/app/pushover-notifications/id506088175",
	"id": 631335,
	"parentId": "631315",
	"dateAddedLocal": "2/27/2022, 1:37:05 AM",
	"dateAddedUTC": "2022-02-27T06:37:05.000Z"
},{
	"index": 20,
	"title": "‎An Otter RSS Reader",
	"url": "https://apps.apple.com/us/app/an-otter-rss-reader/id1529696614",
	"id": 631336,
	"parentId": "631315",
	"dateAddedLocal": "2/27/2022, 1:36:08 AM",
	"dateAddedUTC": "2022-02-27T06:36:08.000Z"
},{
	"index": 21,
	"title": "FS Bookmarks: A Shortcut to Reopen Files and Folders Directly in the Files App",
	"url": "https://www.macstories.net/ios/fs-bookmarks-a-shortcut-to-reopen-files-and-folders-directly-in-the-files-app/",
	"id": 631337,
	"parentId": "631315",
	"dateAddedLocal": "2/26/2022, 9:16:51 PM",
	"dateAddedUTC": "2022-02-27T02:16:51.000Z"
},{
	"index": 22,
	"title": "Plain Org by Xenodium Ltd.",
	"url": "https://apps.apple.com/us/app/plain-org/id1578965002",
	"id": 631338,
	"parentId": "631315",
	"dateAddedLocal": "2/26/2022, 8:06:12 PM",
	"dateAddedUTC": "2022-02-27T01:06:12.000Z"
},{
	"index": 23,
	"title": "Raindrop.io by Rustem Mussabekov",
	"url": "https://apps.apple.com/us/app/raindrop-io/id1021913807",
	"id": 631339,
	"parentId": "631315",
	"dateAddedLocal": "2/26/2022, 8:05:23 PM",
	"dateAddedUTC": "2022-02-27T01:05:23.000Z"
},{
	"index": 24,
	"title": "AppRaven: Apps Gone Free by Simon Zvara",
	"url": "https://apps.apple.com/us/app/appraven-apps-gone-free/id1490607195",
	"id": 631340,
	"parentId": "631315",
	"dateAddedLocal": "2/26/2022, 8:04:43 PM",
	"dateAddedUTC": "2022-02-27T01:04:43.000Z"
},{
	"index": 25,
	"title": "Text Editors on AppRaven",
	"url": "https://appraven.net/openLink.php?listId=62191b2ea0d90374a64bf252",
	"id": 631341,
	"parentId": "631315",
	"dateAddedLocal": "2/25/2022, 2:33:33 PM",
	"dateAddedUTC": "2022-02-25T19:33:33.000Z"
},{
	"index": 26,
	"title": "RegEx on AppRaven",
	"url": "https://appraven.net/openLink.php?listId=62191d8ea0d90374a64bf255",
	"id": 631342,
	"parentId": "631315",
	"dateAddedLocal": "2/25/2022, 2:33:07 PM",
	"dateAddedUTC": "2022-02-25T19:33:07.000Z"
},{
	"index": 27,
	"title": "Spreadsheet and Database on AppRaven",
	"url": "https://appraven.net/openLink.php?listId=62191f5ba0d90374a64bf25d",
	"id": 631343,
	"parentId": "631315",
	"dateAddedLocal": "2/25/2022, 2:32:45 PM",
	"dateAddedUTC": "2022-02-25T19:32:45.000Z"
},{
	"index": 28,
	"title": "Files and Cloud Utilities on AppRaven",
	"url": "https://appraven.net/openLink.php?listId=62191feda0d90374a64bf260",
	"id": 631344,
	"parentId": "631315",
	"dateAddedLocal": "2/25/2022, 2:32:31 PM",
	"dateAddedUTC": "2022-02-25T19:32:31.000Z"
},{
	"index": 29,
	"title": "Personal Knowledge Management on AppRaven",
	"url": "https://appraven.net/collection.php?listId=62185021a0d90374a64bf13c",
	"id": 631345,
	"parentId": "631315",
	"dateAddedLocal": "2/25/2022, 2:29:37 PM",
	"dateAddedUTC": "2022-02-25T19:29:37.000Z"
},{
	"index": 30,
	"title": "Dev Tools on AppRaven",
	"url": "https://appraven.net/collection.php?listId=62181ef9a0d90374a64bf114&page=0",
	"id": 631346,
	"parentId": "631315",
	"dateAddedLocal": "2/25/2022, 2:28:59 PM",
	"dateAddedUTC": "2022-02-25T19:28:59.000Z"
},{
	"index": 31,
	"title": "Text Utilities on AppRaven",
	"url": "https://appraven.net/collection.php?listId=621826e8a0d90374a64bf11f",
	"id": 631347,
	"parentId": "631315",
	"dateAddedLocal": "2/25/2022, 9:17:38 AM",
	"dateAddedUTC": "2022-02-25T14:17:38.000Z"
},{
	"index": 32,
	"title": "‎Bookmarks -URL manager",
	"url": "https://apps.apple.com/us/app/bookmarks-url-manager/id1590304377",
	"id": 631348,
	"parentId": "631315",
	"dateAddedLocal": "2/24/2022, 2:42:05 PM",
	"dateAddedUTC": "2022-02-24T19:42:05.000Z"
},{
	"index": 33,
	"title": "Drafts | Where Text Starts",
	"url": "https://getdrafts.com/",
	"id": 631349,
	"parentId": "631315",
	"dateAddedLocal": "12/12/2021, 9:48:21 AM",
	"dateAddedUTC": "2021-12-12T14:48:21.000Z"
},{
	"index": 34,
	"title": "‎Tot Pocket",
	"url": "https://apps.apple.com/us/app/tot-pocket/id1498235191",
	"id": 631350,
	"parentId": "631315",
	"dateAddedLocal": "1/19/2022, 1:55:24 PM",
	"dateAddedUTC": "2022-01-19T18:55:24.000Z"
},{
	"index": 35,
	"title": "‎Snippit",
	"url": "https://apps.apple.com/us/app/snippit/id1465481124",
	"id": 631351,
	"parentId": "631315",
	"dateAddedLocal": "1/18/2022, 11:15:19 PM",
	"dateAddedUTC": "2022-01-19T04:15:19.000Z"
},{
	"index": 36,
	"title": "Markdown Tables",
	"url": "https://markdowntables.app/",
	"id": 631352,
	"parentId": "631315",
	"dateAddedLocal": "1/18/2022, 3:20:21 PM",
	"dateAddedUTC": "2022-01-18T20:20:21.000Z"
},{
	"index": 37,
	"title": "‎Text Workflow",
	"url": "https://apps.apple.com/us/app/text-workflow/id1600520682?mt=12",
	"id": 631353,
	"parentId": "631315",
	"dateAddedLocal": "1/13/2022, 12:29:39 PM",
	"dateAddedUTC": "2022-01-13T17:29:39.000Z"
},{
	"index": 38,
	"title": "‎NeXeL",
	"url": "https://apps.apple.com/us/app/nexel/id1526317123",
	"id": 631354,
	"parentId": "631315",
	"dateAddedLocal": "12/22/2021, 8:18:28 PM",
	"dateAddedUTC": "2021-12-23T01:18:28.000Z"
},{
	"index": 39,
	"title": "‎Buffer Editor - Code Editor",
	"url": "https://apps.apple.com/us/app/buffer-editor-code-editor/id502633252",
	"id": 631355,
	"parentId": "631315",
	"dateAddedLocal": "12/22/2021, 10:57:32 AM",
	"dateAddedUTC": "2021-12-22T15:57:32.000Z"
},{
	"index": 40,
	"title": "fnd",
	"url": "https://fnd.io/#/us/charts/iphone/new/all",
	"id": 631356,
	"parentId": "631315",
	"dateAddedLocal": "12/17/2021, 8:20:16 AM",
	"dateAddedUTC": "2021-12-17T13:20:16.000Z"
},{
	"index": 41,
	"title": "SpotiStats by Ludovic Burnier",
	"url": "https://apps.apple.com/us/app/spotistats/id1506881892",
	"id": 631357,
	"parentId": "631315",
	"dateAddedLocal": "12/17/2021, 7:46:08 AM",
	"dateAddedUTC": "2021-12-17T12:46:08.000Z"
},{
	"index": 42,
	"title": "Spotistats for Spotify by Sjoerd Bolten",
	"url": "https://apps.apple.com/us/app/spotistats-for-spotify/id1526912392",
	"id": 631358,
	"parentId": "631315",
	"dateAddedLocal": "12/17/2021, 7:45:46 AM",
	"dateAddedUTC": "2021-12-17T12:45:46.000Z"
},{
	"index": 43,
	"title": "Finale for Last.fm by Noah Rubin Technologies LLC",
	"url": "http://last.fm/",
	"id": 631359,
	"parentId": "631315",
	"dateAddedLocal": "12/17/2021, 7:45:11 AM",
	"dateAddedUTC": "2021-12-17T12:45:11.000Z"
},{
	"index": 44,
	"title": "vinylogue for Last.fm by TwoCentStudios",
	"url": "https://apps.apple.com/us/app/vinylogue-for-last-fm/id617471119",
	"id": 631360,
	"parentId": "631315",
	"dateAddedLocal": "12/17/2021, 7:44:24 AM",
	"dateAddedUTC": "2021-12-17T12:44:24.000Z"
},{
	"index": 45,
	"title": "Medium by A Medium Corporation",
	"url": "https://apps.apple.com/us/app/medium/id828256236",
	"id": 631361,
	"parentId": "631315",
	"dateAddedLocal": "12/17/2021, 7:43:12 AM",
	"dateAddedUTC": "2021-12-17T12:43:12.000Z"
},{
	"index": 46,
	"title": "Raindrop.io by Rustem Mussabekov",
	"url": "http://raindrop.io/",
	"id": 631362,
	"parentId": "631315",
	"dateAddedLocal": "12/17/2021, 7:42:41 AM",
	"dateAddedUTC": "2021-12-17T12:42:41.000Z"
},{
	"index": 47,
	"title": "Apollo for Reddit by Christian Selig",
	"url": "https://apps.apple.com/us/app/apollo-for-reddit/id979274575",
	"id": 631363,
	"parentId": "631315",
	"dateAddedLocal": "12/17/2021, 7:41:48 AM",
	"dateAddedUTC": "2021-12-17T12:41:48.000Z"
},{
	"index": 48,
	"title": "Zulip by Kandra Labs, Inc.",
	"url": "https://apps.apple.com/us/app/zulip/id1203036395",
	"id": 631364,
	"parentId": "631315",
	"dateAddedLocal": "12/17/2021, 7:41:33 AM",
	"dateAddedUTC": "2021-12-17T12:41:33.000Z"
},{
	"index": 49,
	"title": "Discord - Talk, Chat & Hangout by Discord, Inc.",
	"url": "https://apps.apple.com/us/app/discord-talk-chat-hangout/id985746746",
	"id": 631365,
	"parentId": "631315",
	"dateAddedLocal": "12/17/2021, 7:41:13 AM",
	"dateAddedUTC": "2021-12-17T12:41:13.000Z"
},{
	"index": 50,
	"title": "Slack by Slack Technologies, Inc.",
	"url": "https://apps.apple.com/us/app/slack/id618783545",
	"id": 631366,
	"parentId": "631315",
	"dateAddedLocal": "12/17/2021, 7:40:33 AM",
	"dateAddedUTC": "2021-12-17T12:40:33.000Z"
},{
	"index": 51,
	"title": "Documents－File Reader. Browser by Readdle Technologies Limited",
	"url": "https://apps.apple.com/us/app/documents-file-reader-browser/id364901807",
	"id": 631367,
	"parentId": "631315",
	"dateAddedLocal": "12/17/2021, 7:39:30 AM",
	"dateAddedUTC": "2021-12-17T12:39:30.000Z"
},{
	"index": 52,
	"title": "Day One Journal: Private Diary by Bloom Built Inc",
	"url": "https://apps.apple.com/us/app/day-one-journal-private-diary/id1044867788",
	"id": 631368,
	"parentId": "631315",
	"dateAddedLocal": "12/17/2021, 7:38:52 AM",
	"dateAddedUTC": "2021-12-17T12:38:52.000Z"
},{
	"index": 53,
	"title": "floatingfile",
	"url": "https://floatingfile.space/?ref=producthunt",
	"id": 631369,
	"parentId": "631315",
	"dateAddedLocal": "12/16/2021, 9:27:18 PM",
	"dateAddedUTC": "2021-12-17T02:27:18.000Z"
},{
	"index": 54,
	"title": "Wisdom: Life Advice Audio on the App Store",
	"url": "https://apps.apple.com/us/app/wisdom-audio-community/id1576484544",
	"id": 631370,
	"parentId": "631315",
	"dateAddedLocal": "12/16/2021, 9:27:18 PM",
	"dateAddedUTC": "2021-12-17T02:27:18.000Z"
},{
	"index": 55,
	"title": "Dashbit",
	"url": "https://dashbit.app/?ref=producthunt",
	"id": 631371,
	"parentId": "631315",
	"dateAddedLocal": "12/16/2021, 9:27:18 PM",
	"dateAddedUTC": "2021-12-17T02:27:18.000Z"
},{
	"index": 56,
	"title": "DeepLinkr on the App Store",
	"url": "https://apps.apple.com/us/app/deeplinkr/id1586244217",
	"id": 631372,
	"parentId": "631315",
	"dateAddedLocal": "12/16/2021, 9:27:18 PM",
	"dateAddedUTC": "2021-12-17T02:27:18.000Z"
},{
	"index": 57,
	"title": "Thinkdrop 2 on the App Store",
	"url": "https://apps.apple.com/app/thinkdrop-2/id1584511088",
	"id": 631373,
	"parentId": "631315",
	"dateAddedLocal": "12/16/2021, 9:27:18 PM",
	"dateAddedUTC": "2021-12-17T02:27:18.000Z"
},{
	"index": 58,
	"title": "Diem | A new social universe",
	"url": "https://www.askdiem.com/?ref=producthunt",
	"id": 631374,
	"parentId": "631315",
	"dateAddedLocal": "12/16/2021, 9:27:18 PM",
	"dateAddedUTC": "2021-12-17T02:27:18.000Z"
},{
	"index": 59,
	"title": "Memo - Rewrite History on the App Store",
	"url": "https://apps.apple.com/app/id1585490424",
	"id": 631375,
	"parentId": "631315",
	"dateAddedLocal": "12/16/2021, 9:27:18 PM",
	"dateAddedUTC": "2021-12-17T02:27:18.000Z"
},{
	"index": 60,
	"title": "Time Tracker - Temi on the App Store",
	"url": "https://apps.apple.com/us/app/temi-personal-time-tracker/id1585205314",
	"id": 631376,
	"parentId": "631315",
	"dateAddedLocal": "12/16/2021, 9:27:18 PM",
	"dateAddedUTC": "2021-12-17T02:27:18.000Z"
},{
	"index": 61,
	"title": "Bon Journal on the App Store",
	"url": "https://apps.apple.com/app/id1476054035",
	"id": 631377,
	"parentId": "631315",
	"dateAddedLocal": "12/16/2021, 9:27:18 PM",
	"dateAddedUTC": "2021-12-17T02:27:18.000Z"
},{
	"index": 62,
	"title": "Continuous Scrolling Search on the App Store",
	"url": "https://apps.apple.com/us/app/infinity-search-foi/id1592066923",
	"id": 631378,
	"parentId": "631315",
	"dateAddedLocal": "12/16/2021, 9:27:18 PM",
	"dateAddedUTC": "2021-12-17T02:27:18.000Z"
},{
	"index": 63,
	"title": "Social Stats Widget on the App Store",
	"url": "https://apps.apple.com/us/app/social-stats-widget/id1533776006",
	"id": 631379,
	"parentId": "631315",
	"dateAddedLocal": "12/16/2021, 9:27:18 PM",
	"dateAddedUTC": "2021-12-17T02:27:18.000Z"
},{
	"index": 64,
	"title": "Wellwork App | Mindful Productivity",
	"url": "https://www.wellworkapp.com/?ref=producthunt",
	"id": 631380,
	"parentId": "631315",
	"dateAddedLocal": "12/16/2021, 9:27:18 PM",
	"dateAddedUTC": "2021-12-17T02:27:18.000Z"
},{
	"index": 65,
	"title": "Atlas Obscura Travel Guide on the App Store",
	"url": "https://apps.apple.com/app/apple-store/id1563250221",
	"id": 631381,
	"parentId": "631315",
	"dateAddedLocal": "12/16/2021, 9:27:18 PM",
	"dateAddedUTC": "2021-12-17T02:27:18.000Z"
},{
	"index": 66,
	"title": "Phone Tracking App | Free Mobile Number Tracker | Spy Caught Cheating",
	"url": "https://www.spouseware.net/?ref=producthunt",
	"id": 631382,
	"parentId": "631315",
	"dateAddedLocal": "12/16/2021, 9:27:18 PM",
	"dateAddedUTC": "2021-12-17T02:27:18.000Z"
},{
	"index": 67,
	"title": "Emerson - an AI Persona That Talks Like a Human",
	"url": "https://www.quickchat.ai/emerson?ref=producthunt",
	"id": 631383,
	"parentId": "631315",
	"dateAddedLocal": "12/16/2021, 9:27:18 PM",
	"dateAddedUTC": "2021-12-17T02:27:18.000Z"
},{
	"index": 68,
	"title": "Dailyx - Selfie a Day",
	"url": "https://dailyx.app/?ref=producthunt",
	"id": 631384,
	"parentId": "631315",
	"dateAddedLocal": "12/16/2021, 9:27:18 PM",
	"dateAddedUTC": "2021-12-17T02:27:18.000Z"
},{
	"index": 69,
	"title": "Voiceliner",
	"url": "https://a9.io/voiceliner/?ref=producthunt",
	"id": 631385,
	"parentId": "631315",
	"dateAddedLocal": "12/16/2021, 9:07:03 PM",
	"dateAddedUTC": "2021-12-17T02:07:03.000Z"
},{
	"index": 70,
	"title": "Dimensional",
	"url": "https://www.dimensional.me/?ref=producthunt",
	"id": 631386,
	"parentId": "631315",
	"dateAddedLocal": "12/16/2021, 7:37:45 PM",
	"dateAddedUTC": "2021-12-17T00:37:45.000Z"
},{
	"index": 71,
	"title": "iOS Shortcuts",
	"id": 631387,
	"parentId": "631315",
	"dateAddedLocal": "10/25/2022, 12:34:39 PM",
	"dateAddedUTC": "2022-10-25T16:34:39.608Z"
},{
	"index": 0,
	"title": "Showcuts",
	"url": "https://showcuts.app/share/view",
	"id": 631388,
	"parentId": "631387",
	"dateAddedLocal": "2/19/2022, 6:23:54 PM",
	"dateAddedUTC": "2022-02-19T23:23:54.000Z"
},{
	"index": 1,
	"title": "5 Inspiring Apple Shortcuts (macOS)",
	"url": "https://medium.com/@richardmoult75/5-more-interesting-mac-shortcuts-to-learn-from-e63c4566e16d",
	"id": 631389,
	"parentId": "631387",
	"dateAddedLocal": "1/26/2022, 8:34:52 PM",
	"dateAddedUTC": "2022-01-27T01:34:52.000Z"
},{
	"index": 2,
	"title": "Launch a shortcut from another app on iPhone or iPad",
	"url": "https://support.apple.com/en-au/guide/shortcuts/apd163eb9f95/5.0/ios/15.0",
	"id": 631390,
	"parentId": "631387",
	"dateAddedLocal": "1/26/2022, 8:39:28 PM",
	"dateAddedUTC": "2022-01-27T01:39:28.000Z"
},{
	"index": 3,
	"title": "Run a shortcut from the Shortcuts app on iPhone or iPad",
	"url": "https://support.apple.com/en-au/guide/shortcuts/apd5ba077760/ios",
	"id": 631391,
	"parentId": "631387",
	"dateAddedLocal": "1/26/2022, 8:39:12 PM",
	"dateAddedUTC": "2022-01-27T01:39:12.000Z"
},{
	"index": 4,
	"title": "Use Siri to run shortcuts with your voice",
	"url": "https://support.apple.com/en-au/guide/shortcuts/apd07c25bb38/5.0/ios/15.0",
	"id": 631392,
	"parentId": "631387",
	"dateAddedLocal": "1/26/2022, 8:38:59 PM",
	"dateAddedUTC": "2022-01-27T01:38:59.000Z"
},{
	"index": 5,
	"title": "How to use an Apple Shortcut Menu + Variables Actions",
	"url": "https://medium.com/@richardmoult75/how-to-use-an-apple-shortcut-menu-variables-actions-3349676e183a",
	"id": 631393,
	"parentId": "631387",
	"dateAddedLocal": "1/26/2022, 8:38:39 PM",
	"dateAddedUTC": "2022-01-27T01:38:39.000Z"
},{
	"index": 6,
	"title": "How to use Shortcuts to enter data into an API",
	"url": "https://medium.com/@richardmoult75/how-to-use-shortcuts-to-enter-data-into-api-6983db92852b",
	"id": 631394,
	"parentId": "631387",
	"dateAddedLocal": "1/26/2022, 8:37:40 PM",
	"dateAddedUTC": "2022-01-27T01:37:40.000Z"
},{
	"index": 7,
	"title": "Parsing JSON API lists with Shortcuts",
	"url": "https://medium.com/@richardmoult75/parsing-json-api-lists-with-shortcuts-20df08aedf09",
	"id": 631395,
	"parentId": "631387",
	"dateAddedLocal": "1/26/2022, 8:37:27 PM",
	"dateAddedUTC": "2022-01-27T01:37:27.000Z"
},{
	"index": 8,
	"title": "How to use an API with Apple Shortcuts",
	"url": "https://medium.com/@richardmoult75/how-to-use-an-api-with-apple-shortcuts-ce116e37fcfd",
	"id": 631396,
	"parentId": "631387",
	"dateAddedLocal": "1/26/2022, 8:37:07 PM",
	"dateAddedUTC": "2022-01-27T01:37:07.000Z"
},{
	"index": 9,
	"title": "Create simple RSS feed using iPhone Shortcuts and auto install on Mac menu bar",
	"url": "https://medium.com/@richardmoult75/create-simple-rss-viewer-using-iphone-shortcuts-and-auto-install-on-mac-menu-bar-4447a0444682",
	"id": 631397,
	"parentId": "631387",
	"dateAddedLocal": "1/26/2022, 8:36:47 PM",
	"dateAddedUTC": "2022-01-27T01:36:47.000Z"
},{
	"index": 10,
	"title": "How to schedule macOS Shortcuts",
	"url": "https://medium.com/@richardmoult75/how-to-schedule-macos-shortcuts-96774f6972ac",
	"id": 631398,
	"parentId": "631387",
	"dateAddedLocal": "1/26/2022, 8:36:24 PM",
	"dateAddedUTC": "2022-01-27T01:36:24.000Z"
},{
	"index": 11,
	"title": "Dynamic Apple Shortcuts (Monterey macOS)",
	"url": "https://medium.com/@richardmoult75/setting-up-a-shortcut-monterey-macos-8da87d408215",
	"id": 631399,
	"parentId": "631387",
	"dateAddedLocal": "1/26/2022, 8:36:03 PM",
	"dateAddedUTC": "2022-01-27T01:36:03.000Z"
},{
	"index": 12,
	"title": "macOS Shortcuts, Quick Actions",
	"url": "https://medium.com/@richardmoult75/macos-shortcuts-easy-access-ff9f919e9343",
	"id": 631400,
	"parentId": "631387",
	"dateAddedLocal": "1/26/2022, 8:35:45 PM",
	"dateAddedUTC": "2022-01-27T01:35:45.000Z"
},{
	"index": 13,
	"title": "Creating macOS Monterey Shortcuts for Multiple files",
	"url": "https://medium.com/@richardmoult75/creating-macos-monterey-shortcuts-for-multiple-files-9ead8f371bf4",
	"id": 631401,
	"parentId": "631387",
	"dateAddedLocal": "1/26/2022, 8:35:21 PM",
	"dateAddedUTC": "2022-01-27T01:35:21.000Z"
},{
	"index": 14,
	"title": "5 interesting macOS Shortcuts",
	"url": "https://medium.com/@richardmoult75/5-interesting-macos-shortcuts-24f98854ee2c",
	"id": 631402,
	"parentId": "631387",
	"dateAddedLocal": "1/26/2022, 8:34:34 PM",
	"dateAddedUTC": "2022-01-27T01:34:34.000Z"
},{
	"index": 15,
	"title": "360000098827 creating triggers on i os",
	"url": "https://support.idevicesinc.com/hc/en-us/articles/360000098827-Creating-Triggers-On-iOS",
	"id": 631403,
	"parentId": "631387",
	"dateAddedLocal": "12/19/2021, 11:56:52 PM",
	"dateAddedUTC": "2021-12-20T04:56:52.000Z"
},{
	"index": 16,
	"title": "Easy Ways to Fix iPhone Automation Not Working in iOS 15",
	"url": "https://itoolab.com/fix/iphone-automation-not-working/",
	"id": 631404,
	"parentId": "631387",
	"dateAddedLocal": "12/19/2021, 11:56:26 PM",
	"dateAddedUTC": "2021-12-20T04:56:26.000Z"
},{
	"index": 17,
	"title": "fastlane - App automation done right",
	"url": "https://fastlane.tools/",
	"id": 631405,
	"parentId": "631387",
	"dateAddedLocal": "12/19/2021, 11:55:33 PM",
	"dateAddedUTC": "2021-12-20T04:55:33.000Z"
},{
	"index": 18,
	"title": "Announcing the Shortcuts Catalog for iOS 14, feat. 300 shortcuts & 300 actions",
	"url": "https://www.matthewcassinelli.com/shortcuts-catalog-ios-14/",
	"id": 631406,
	"parentId": "631387",
	"dateAddedLocal": "12/19/2021, 11:48:38 PM",
	"dateAddedUTC": "2021-12-20T04:48:38.000Z"
},{
	"index": 19,
	"title": "https://appletoolbox.com/shortcuts-tips-and-tricks-to-take-your-iphone-automations-to-the-next-level/amp/",
	"url": "https://appletoolbox.com/shortcuts-tips-and-tricks-to-take-your-iphone-automations-to-the-next-level/amp/",
	"id": 631407,
	"parentId": "631387",
	"dateAddedLocal": "12/19/2021, 11:48:13 PM",
	"dateAddedUTC": "2021-12-20T04:48:13.000Z"
},{
	"index": 20,
	"title": "12 Best Siri Shortcuts and Automations for iPhone Power Users",
	"url": "https://beebom.com/best-siri-shortcuts-automations/",
	"id": 631408,
	"parentId": "631387",
	"dateAddedLocal": "12/19/2021, 11:47:11 PM",
	"dateAddedUTC": "2021-12-20T04:47:11.000Z"
},{
	"index": 21,
	"title": "Pushcut - Help & Support",
	"url": "https://www.pushcut.io/support.html",
	"id": 631409,
	"parentId": "631387",
	"dateAddedLocal": "12/19/2021, 11:46:42 PM",
	"dateAddedUTC": "2021-12-20T04:46:42.000Z"
},{
	"index": 22,
	"title": "A Beginner's Guide to Shortcuts Automation on iPhone",
	"url": "https://www.makeuseof.com/beginners-guide-shortcuts-automation-iphone/",
	"id": 631410,
	"parentId": "631387",
	"dateAddedLocal": "12/19/2021, 11:41:25 PM",
	"dateAddedUTC": "2021-12-20T04:41:25.000Z"
},{
	"index": 23,
	"title": "‎Shortcuts Utilities",
	"url": "https://apps.apple.com/us/app/shortcuts-utilities/id1475283333",
	"id": 631411,
	"parentId": "631387",
	"dateAddedLocal": "12/17/2021, 8:36:13 AM",
	"dateAddedUTC": "2021-12-17T13:36:13.000Z"
},{
	"index": 24,
	"title": "Tenta - Self Push Notification by DOYBLS",
	"url": "https://apps.apple.com/us/app/tenta-self-push-notification/id1553532645",
	"id": 631412,
	"parentId": "631387",
	"dateAddedLocal": "12/17/2021, 12:36:12 AM",
	"dateAddedUTC": "2021-12-17T05:36:12.000Z"
},{
	"index": 25,
	"title": "Shortify Actions by Lorenzo Ferrante",
	"url": "https://apps.apple.com/us/app/shortify-actions/id1448864001",
	"id": 631413,
	"parentId": "631387",
	"dateAddedLocal": "12/17/2021, 12:35:14 AM",
	"dateAddedUTC": "2021-12-17T05:35:14.000Z"
},{
	"index": 26,
	"title": "Charty for Shortcuts by Rodrigo Araujo",
	"url": "https://apps.apple.com/us/app/charty-for-shortcuts/id1494386093",
	"id": 631414,
	"parentId": "631387",
	"dateAddedLocal": "12/17/2021, 12:34:57 AM",
	"dateAddedUTC": "2021-12-17T05:34:57.000Z"
},{
	"index": 27,
	"title": "CSV Tools by Tomas Parizek",
	"url": "https://apps.apple.com/us/app/csv-tools/id1521133371",
	"id": 631415,
	"parentId": "631387",
	"dateAddedLocal": "12/17/2021, 12:34:39 AM",
	"dateAddedUTC": "2021-12-17T05:34:39.000Z"
},{
	"index": 28,
	"title": "Actions by Sindre Sorhus",
	"url": "https://apps.apple.com/us/app/actions/id1586435171",
	"id": 631416,
	"parentId": "631387",
	"dateAddedLocal": "12/17/2021, 12:34:22 AM",
	"dateAddedUTC": "2021-12-17T05:34:22.000Z"
},{
	"index": 29,
	"title": "Jayson by Simon B. Støvring",
	"url": "https://apps.apple.com/us/app/jayson/id1447750768",
	"id": 631417,
	"parentId": "631387",
	"dateAddedLocal": "12/17/2021, 12:34:06 AM",
	"dateAddedUTC": "2021-12-17T05:34:06.000Z"
},{
	"index": 30,
	"title": "Data Jar by Simon B. Støvring",
	"url": "https://apps.apple.com/us/app/data-jar/id1453273600",
	"id": 631418,
	"parentId": "631387",
	"dateAddedLocal": "12/17/2021, 12:33:50 AM",
	"dateAddedUTC": "2021-12-17T05:33:50.000Z"
},{
	"index": 31,
	"title": "‎GizmoPack",
	"url": "https://apps.apple.com/us/app/gizmopack/id1505218567",
	"id": 631419,
	"parentId": "631387",
	"dateAddedLocal": "12/17/2021, 12:33:25 AM",
	"dateAddedUTC": "2021-12-17T05:33:25.000Z"
},{
	"index": 32,
	"title": "Scriptable by Simon B. Støvring",
	"url": "https://apps.apple.com/us/app/scriptable/id1405459188",
	"id": 631420,
	"parentId": "631387",
	"dateAddedLocal": "12/17/2021, 12:32:59 AM",
	"dateAddedUTC": "2021-12-17T05:32:59.000Z"
},{
	"index": 33,
	"title": "‎Pushcut: Shortcuts Automation",
	"url": "https://apps.apple.com/us/app/pushcut-shortcuts-automation/id1450936447",
	"id": 631421,
	"parentId": "631387",
	"dateAddedLocal": "12/17/2021, 12:32:23 AM",
	"dateAddedUTC": "2021-12-17T05:32:23.000Z"
},{
	"index": 3,
	"title": "Windows Software",
	"id": 631422,
	"parentId": "631230",
	"dateAddedLocal": "10/25/2022, 12:34:39 PM",
	"dateAddedUTC": "2022-10-25T16:34:39.609Z"
},{
	"index": 0,
	"title": "https://resist.berlin/",
	"url": "https://resist.berlin/",
	"id": 631423,
	"parentId": "631422",
	"dateAddedLocal": "3/15/2022, 2:28:47 PM",
	"dateAddedUTC": "2022-03-15T18:28:47.000Z"
},{
	"index": 1,
	"title": "Portal:Free and open-source software/Categories - Wikipedia",
	"url": "https://en.wikipedia.org/wiki/Portal:Free_and_open-source_software/Categories",
	"id": 631424,
	"parentId": "631422",
	"dateAddedLocal": "3/12/2022, 3:00:49 PM",
	"dateAddedUTC": "2022-03-12T20:00:49.000Z"
},{
	"index": 2,
	"title": "Bram Wiepjes / baserow",
	"url": "https://gitlab.com/bramw/baserow",
	"id": 631425,
	"parentId": "631422",
	"dateAddedLocal": "1/17/2022, 11:38:25 PM",
	"dateAddedUTC": "2022-01-18T04:38:25.000Z"
},{
	"index": 3,
	"title": "Office Tool Plus Website - Easy to Deploy Office",
	"url": "https://otp.landian.vip/en-us",
	"id": 631426,
	"parentId": "631422",
	"dateAddedLocal": "1/17/2022, 11:38:26 PM",
	"dateAddedUTC": "2022-01-18T04:38:26.000Z"
},{
	"index": 4,
	"title": "MediaElch",
	"url": "https://www.kvibes.de/mediaelch",
	"id": 631427,
	"parentId": "631422",
	"dateAddedLocal": "1/17/2022, 11:38:28 PM",
	"dateAddedUTC": "2022-01-18T04:38:28.000Z"
},{
	"index": 5,
	"title": "Welcome to Bunch",
	"url": "https://bunchapp.co/?ref=producthunt",
	"id": 631428,
	"parentId": "631422",
	"dateAddedLocal": "12/21/2021, 7:14:14 AM",
	"dateAddedUTC": "2021-12-21T12:14:14.000Z"
},{
	"index": 6,
	"title": "Marta",
	"url": "https://marta.sh/?ref=producthunt",
	"id": 631429,
	"parentId": "631422",
	"dateAddedLocal": "12/21/2021, 6:02:29 AM",
	"dateAddedUTC": "2021-12-21T11:02:29.000Z"
},{
	"index": 7,
	"title": "Software and technology stacks used by top companies",
	"url": "https://www.stackshare.io/",
	"id": 631430,
	"parentId": "631422",
	"dateAddedLocal": "12/18/2021, 12:46:47 PM",
	"dateAddedUTC": "2021-12-18T17:46:47.000Z"
},{
	"index": 8,
	"title": "Latest entries",
	"url": "https://www.portablefreeware.com/",
	"id": 631431,
	"parentId": "631422",
	"dateAddedLocal": "11/7/2021, 4:08:12 PM",
	"dateAddedUTC": "2021-11-07T21:08:12.000Z"
},{
	"index": 9,
	"title": "Fcportables's Pastebin",
	"url": "https://pastebin.com/u/fcportables",
	"id": 631432,
	"parentId": "631422",
	"dateAddedLocal": "5/10/2022, 9:29:52 AM",
	"dateAddedUTC": "2022-05-10T13:29:52.000Z"
},{
	"index": 10,
	"title": "Cross Platform",
	"id": 631433,
	"parentId": "631422",
	"dateAddedLocal": "10/25/2022, 12:34:39 PM",
	"dateAddedUTC": "2022-10-25T16:34:39.610Z"
},{
	"index": 0,
	"title": "Ferdi",
	"url": "https://getferdi.com/",
	"id": 631434,
	"parentId": "631433",
	"dateAddedLocal": "11/19/2021, 1:07:54 PM",
	"dateAddedUTC": "2021-11-19T18:07:54.000Z"
},{
	"index": 1,
	"title": "Phone2 | Second Phone Number for Small Business and Teams",
	"url": "https://www.phone2.io/?ref=producthunt",
	"id": 631435,
	"parentId": "631433",
	"dateAddedLocal": "12/16/2021, 8:53:52 PM",
	"dateAddedUTC": "2021-12-17T01:53:52.000Z"
},{
	"index": 2,
	"title": "Wormhole - Browse & Control phone on PC, Screen Fusion for iOS & Android",
	"url": "https://er.run/",
	"id": 631436,
	"parentId": "631433",
	"dateAddedLocal": "12/16/2021, 12:56:47 PM",
	"dateAddedUTC": "2021-12-16T17:56:47.000Z"
},{
	"index": 11,
	"title": "Customizing OS",
	"id": 631437,
	"parentId": "631422",
	"dateAddedLocal": "10/25/2022, 12:34:39 PM",
	"dateAddedUTC": "2022-10-25T16:34:39.610Z"
},{
	"index": 0,
	"title": "Download - AME",
	"url": "https://ameliorated.info/index.html",
	"id": 631438,
	"parentId": "631437",
	"dateAddedLocal": "2/24/2022, 8:17:34 AM",
	"dateAddedUTC": "2022-02-24T13:17:34.000Z"
},{
	"index": 1,
	"title": "Cairo Desktop Environment",
	"url": "https://cairoshell.com/",
	"id": 631439,
	"parentId": "631437",
	"dateAddedLocal": "2/24/2022, 8:17:34 AM",
	"dateAddedUTC": "2022-02-24T13:17:34.000Z"
},{
	"index": 12,
	"title": "Drivers",
	"id": 631440,
	"parentId": "631422",
	"dateAddedLocal": "10/25/2022, 12:34:39 PM",
	"dateAddedUTC": "2022-10-25T16:34:39.610Z"
},{
	"index": 0,
	"title": "DriverHub",
	"url": "https://www.drvhub.net/",
	"id": 631441,
	"parentId": "631440",
	"dateAddedLocal": "2/24/2022, 8:17:34 AM",
	"dateAddedUTC": "2022-02-24T13:17:34.000Z"
},{
	"index": 1,
	"title": "DriverOff.net",
	"url": "https://driveroff.net/",
	"id": 631442,
	"parentId": "631440",
	"dateAddedLocal": "2/24/2022, 8:17:34 AM",
	"dateAddedUTC": "2022-02-24T13:17:34.000Z"
},{
	"index": 2,
	"title": "DriverPack Solution",
	"url": "https://driverpack.io/",
	"id": 631443,
	"parentId": "631440",
	"dateAddedLocal": "2/24/2022, 8:17:34 AM",
	"dateAddedUTC": "2022-02-24T13:17:34.000Z"
},{
	"index": 3,
	"title": "DriversCollection.com",
	"url": "https://driverscollection.com/",
	"id": 631444,
	"parentId": "631440",
	"dateAddedLocal": "2/24/2022, 8:17:34 AM",
	"dateAddedUTC": "2022-02-24T13:17:34.000Z"
},{
	"index": 4,
	"title": "Semantic",
	"url": "https://semantic.gs/",
	"id": 631445,
	"parentId": "631440",
	"dateAddedLocal": "2/24/2022, 8:17:34 AM",
	"dateAddedUTC": "2022-02-24T13:17:34.000Z"
},{
	"index": 5,
	"title": "Station-drivers",
	"url": "https://www.station-drivers.com/",
	"id": 631446,
	"parentId": "631440",
	"dateAddedLocal": "2/24/2022, 8:17:34 AM",
	"dateAddedUTC": "2022-02-24T13:17:34.000Z"
},{
	"index": 6,
	"title": "TousLesDrivers",
	"url": "https://www.touslesdrivers.com/",
	"id": 631447,
	"parentId": "631440",
	"dateAddedLocal": "2/24/2022, 8:17:34 AM",
	"dateAddedUTC": "2022-02-24T13:17:34.000Z"
},{
	"index": 13,
	"title": "File Management",
	"id": 631448,
	"parentId": "631422",
	"dateAddedLocal": "10/25/2022, 12:34:39 PM",
	"dateAddedUTC": "2022-10-25T16:34:39.610Z"
},{
	"index": 0,
	"title": "Automate Data Capture",
	"url": "https://www.docdigitizer.com/",
	"id": 631449,
	"parentId": "631448",
	"dateAddedLocal": "12/16/2021, 12:55:18 PM",
	"dateAddedUTC": "2021-12-16T17:55:18.000Z"
},{
	"index": 14,
	"title": "Mobile & Desktop Tracking Software",
	"id": 631450,
	"parentId": "631422",
	"dateAddedLocal": "10/25/2022, 12:34:39 PM",
	"dateAddedUTC": "2022-10-25T16:34:39.610Z"
},{
	"index": 0,
	"title": "Spyrix Personal Monitor. Remote monitoring of computers",
	"url": "https://www.spyrix.com/spyrix-personal-monitor.php",
	"id": 631451,
	"parentId": "631450",
	"dateAddedLocal": "12/16/2021, 1:00:12 PM",
	"dateAddedUTC": "2021-12-16T18:00:12.000Z"
},{
	"index": 15,
	"title": "Software (Free or Open Source)",
	"id": 631452,
	"parentId": "631422",
	"dateAddedLocal": "10/25/2022, 12:34:39 PM",
	"dateAddedUTC": "2022-10-25T16:34:39.610Z"
},{
	"index": 0,
	"title": "WinTools.Info - Usable Windows Tools",
	"url": "https://www.wintools.info/",
	"id": 631453,
	"parentId": "631452",
	"dateAddedLocal": "3/12/2022, 4:35:10 PM",
	"dateAddedUTC": "2022-03-12T21:35:10.000Z"
},{
	"index": 1,
	"title": "FDMlib",
	"url": "https://en.freedownloadmanager.org/Windows-PC",
	"id": 631454,
	"parentId": "631452",
	"dateAddedLocal": "2/24/2022, 8:17:34 AM",
	"dateAddedUTC": "2022-02-24T13:17:34.000Z"
},{
	"index": 2,
	"title": "Filecroco",
	"url": "https://www.filecroco.com/",
	"id": 631455,
	"parentId": "631452",
	"dateAddedLocal": "2/24/2022, 8:17:34 AM",
	"dateAddedUTC": "2022-02-24T13:17:34.000Z"
},{
	"index": 3,
	"title": "Malavida",
	"url": "https://www.malavida.com/en/windows",
	"id": 631456,
	"parentId": "631452",
	"dateAddedLocal": "2/24/2022, 8:17:34 AM",
	"dateAddedUTC": "2022-02-24T13:17:34.000Z"
},{
	"index": 4,
	"title": "Soft32",
	"url": "https://www.soft32.com/",
	"id": 631457,
	"parentId": "631452",
	"dateAddedLocal": "2/24/2022, 8:17:34 AM",
	"dateAddedUTC": "2022-02-24T13:17:34.000Z"
},{
	"index": 5,
	"title": "Softpedia",
	"url": "https://www.softpedia.com/",
	"id": 631458,
	"parentId": "631452",
	"dateAddedLocal": "2/24/2022, 8:17:34 AM",
	"dateAddedUTC": "2022-02-24T13:17:34.000Z"
},{
	"index": 6,
	"title": "Software Directory for Windows XP (32/64 bit) in English",
	"url": "https://allxpsoft.com/",
	"id": 631459,
	"parentId": "631452",
	"dateAddedLocal": "2/24/2022, 8:17:34 AM",
	"dateAddedUTC": "2022-02-24T13:17:34.000Z"
},{
	"index": 7,
	"title": "Open Source @ IFTTT",
	"url": "http://ifttt.github.io/?ref=producthunt",
	"id": 631460,
	"parentId": "631452",
	"dateAddedLocal": "12/19/2021, 12:40:54 PM",
	"dateAddedUTC": "2021-12-19T17:40:54.000Z"
},{
	"index": 8,
	"title": "Open-Source Application Development",
	"url": "https://add0n.com/",
	"id": 631461,
	"parentId": "631452",
	"dateAddedLocal": "11/19/2021, 1:07:54 PM",
	"dateAddedUTC": "2021-11-19T18:07:54.000Z"
},{
	"index": 9,
	"title": "FOSSHUB",
	"url": "https://www.fosshub.com/",
	"id": 631462,
	"parentId": "631452",
	"dateAddedLocal": "11/7/2021, 4:08:12 PM",
	"dateAddedUTC": "2021-11-07T21:08:12.000Z"
},{
	"index": 10,
	"title": "Sourceforge",
	"url": "https://sourceforge.net/",
	"id": 631463,
	"parentId": "631452",
	"dateAddedLocal": "11/19/2021, 1:07:54 PM",
	"dateAddedUTC": "2021-11-19T18:07:54.000Z"
},{
	"index": 11,
	"title": "Open Hub, the open source network",
	"url": "https://www.openhub.net/",
	"id": 631464,
	"parentId": "631452",
	"dateAddedLocal": "11/7/2021, 4:08:12 PM",
	"dateAddedUTC": "2021-11-07T21:08:12.000Z"
},{
	"index": 12,
	"title": "🥇Free Download Windows Software And Games",
	"url": "https://www.download.hr/",
	"id": 631465,
	"parentId": "631452",
	"dateAddedLocal": "2/24/2022, 8:17:34 AM",
	"dateAddedUTC": "2022-02-24T13:17:34.000Z"
},{
	"index": 13,
	"title": "Download Diagnostics Tools for Windows - MajorGeeks",
	"url": "https://www.majorgeeks.com/mg/sortdate/diagnostics.html",
	"id": 631466,
	"parentId": "631452",
	"dateAddedLocal": "2/24/2022, 8:17:34 AM",
	"dateAddedUTC": "2022-02-24T13:17:34.000Z"
},{
	"index": 14,
	"title": "Download iBackup Viewer Pro 4.14.0 - SoftArchive",
	"url": "https://sanet.st/blogs/samura1-/ibackup_viewer_pro.2944746.html",
	"id": 631467,
	"parentId": "631452",
	"dateAddedLocal": "2/24/2022, 8:17:34 AM",
	"dateAddedUTC": "2022-02-24T13:17:34.000Z"
},{
	"index": 15,
	"title": "Download Joyoshare UltFix 1.0.0.9 - SoftArchive",
	"url": "https://sanet.st/blogs/reliz/joyoshare_ultfix.2907031.html",
	"id": 631468,
	"parentId": "631452",
	"dateAddedLocal": "2/24/2022, 8:17:34 AM",
	"dateAddedUTC": "2022-02-24T13:17:34.000Z"
},{
	"index": 16,
	"title": "FC Portables",
	"url": "https://www.fcportables.com/software",
	"id": 631469,
	"parentId": "631452",
	"dateAddedLocal": "2/24/2022, 8:17:34 AM",
	"dateAddedUTC": "2022-02-24T13:17:34.000Z"
},{
	"index": 17,
	"title": "KubaDownload.com - download software hub, iOS jailbreak news",
	"url": "https://kubadownload.com/",
	"id": 631470,
	"parentId": "631452",
	"dateAddedLocal": "2/24/2022, 8:17:34 AM",
	"dateAddedUTC": "2022-02-24T13:17:34.000Z"
},{
	"index": 18,
	"title": "App news and reviews, best software downloads and discovery - Softonic",
	"url": "https://en.softonic.com/",
	"id": 631471,
	"parentId": "631452",
	"dateAddedLocal": "11/19/2021, 1:07:54 PM",
	"dateAddedUTC": "2021-11-19T18:07:54.000Z"
},{
	"index": 19,
	"title": "Download Free Software, Apps and Games | SoftMozer.com",
	"url": "https://www.softmozer.com/",
	"id": 631472,
	"parentId": "631452",
	"dateAddedLocal": "11/7/2021, 4:08:12 PM",
	"dateAddedUTC": "2021-11-07T21:08:12.000Z"
},{
	"index": 20,
	"title": "Download Freeware and Shareware Software, Reviews, Ratings",
	"url": "https://softwarevilla.com/",
	"id": 631473,
	"parentId": "631452",
	"dateAddedLocal": "11/7/2021, 4:08:12 PM",
	"dateAddedUTC": "2021-11-07T21:08:12.000Z"
},{
	"index": 21,
	"title": "FileHorse.com / Free Software Download for Windows",
	"url": "https://www.filehorse.com/",
	"id": 631474,
	"parentId": "631452",
	"dateAddedLocal": "11/7/2021, 4:08:12 PM",
	"dateAddedUTC": "2021-11-07T21:08:12.000Z"
},{
	"index": 22,
	"title": "Find best open source projects across all platforms",
	"url": "https://www.findbestopensource.com/home",
	"id": 631475,
	"parentId": "631452",
	"dateAddedLocal": "11/7/2021, 4:08:12 PM",
	"dateAddedUTC": "2021-11-07T21:08:12.000Z"
},{
	"index": 23,
	"title": "Fossies - The Fresh Open Source Software Archive: Index of all software packages",
	"url": "https://fossies.org/all.html",
	"id": 631476,
	"parentId": "631452",
	"dateAddedLocal": "11/7/2021, 4:08:12 PM",
	"dateAddedUTC": "2021-11-07T21:08:12.000Z"
},{
	"index": 24,
	"title": "Free Software Directory",
	"url": "https://directory.fsf.org/wiki/Main_Page",
	"id": 631477,
	"parentId": "631452",
	"dateAddedLocal": "11/7/2021, 4:08:12 PM",
	"dateAddedUTC": "2021-11-07T21:08:12.000Z"
},{
	"index": 25,
	"title": "Freesoff | Community For Sharing Free Knowledge",
	"url": "https://freesoff.com/",
	"id": 631478,
	"parentId": "631452",
	"dateAddedLocal": "11/7/2021, 4:08:12 PM",
	"dateAddedUTC": "2021-11-07T21:08:12.000Z"
},{
	"index": 26,
	"title": "Home - Software reviews, downloads, news, free trials, freeware and full commercial software - Downloadcrew",
	"url": "https://www.downloadcrew.com/",
	"id": 631479,
	"parentId": "631452",
	"dateAddedLocal": "11/7/2021, 4:08:12 PM",
	"dateAddedUTC": "2021-11-07T21:08:12.000Z"
},{
	"index": 27,
	"title": "Karan PC - download free software full",
	"url": "https://karanpc.com/",
	"id": 631480,
	"parentId": "631452",
	"dateAddedLocal": "11/7/2021, 4:08:12 PM",
	"dateAddedUTC": "2021-11-07T21:08:12.000Z"
},{
	"index": 28,
	"title": "LO4D.com",
	"url": "https://www.lo4d.com/",
	"id": 631481,
	"parentId": "631452",
	"dateAddedLocal": "11/7/2021, 4:08:12 PM",
	"dateAddedUTC": "2021-11-07T21:08:12.000Z"
},{
	"index": 29,
	"title": "List Of Freeware",
	"url": "https://listoffreeware.com/",
	"id": 631482,
	"parentId": "631452",
	"dateAddedLocal": "11/7/2021, 4:08:12 PM",
	"dateAddedUTC": "2021-11-07T21:08:12.000Z"
},{
	"index": 30,
	"title": "MajorGeeks.Com - MajorGeeks",
	"url": "https://www.majorgeeks.com/",
	"id": 631483,
	"parentId": "631452",
	"dateAddedLocal": "11/7/2021, 4:08:12 PM",
	"dateAddedUTC": "2021-11-07T21:08:12.000Z"
},{
	"index": 31,
	"title": "MenuMagic Information",
	"url": "http://www.agitatedstate.com/html/menumagic.php",
	"id": 631484,
	"parentId": "631452",
	"dateAddedLocal": "11/7/2021, 4:08:12 PM",
